id,zverejneni,uzavreni,subjekt,ico,bezdph,sdph,predmet,odkaz,cena
7313,2016-07-14T12:28:16+02:00,2016-07-13,Město Nové Město na Moravě,00294900,16100.0,,"Směnná smlouva - převod z majetku města (p.č. 2738/5 v k.ú. NMNM), převod do majetku města (p.č.1442/27, 2738/6 v k.ú. NMNM)",https://smlouvy.gov.cz/smlouva/7505,16100.0
7317,2016-07-14T12:30:19+02:00,2016-06-27,Fakturace (Ministerstvo obrany),60162694,,77000.0,684820 - Autoinjektor 1-komorový,https://smlouvy.gov.cz/smlouva/7509,77000.0
7321,2016-07-14T12:30:17+02:00,2016-07-08,"Správa a údržba silnic Plzeňského kraje, příspěvková organizace",72053119,140496.0,,Projektová dokumentace III/19846 Velký Rapotín - Částkov,https://smlouvy.gov.cz/smlouva/7513,140496.0
7325,2016-07-14T12:30:16+02:00,2016-07-07,"Správa a údržba silnic Plzeňského kraje, příspěvková organizace",72053119,198000.0,,"Projektová dokumentace II/117, Strašice - Mirošov, III. etapa - Dobřív",https://smlouvy.gov.cz/smlouva/7517,198000.0
7329,2016-07-14T12:31:33+02:00,2016-07-13,Město Nové Město na Moravě,00294900,16100.0,,"Směnná smlouva - převod z majetku města (p.č. 2738/5 v k.ú. NMNM), převod do majetku města (p.č.1442/27, 2738/6 v k.ú. NMNM)",https://smlouvy.gov.cz/smlouva/7521,16100.0
7333,2016-07-14T12:31:39+02:00,2016-07-08,Územní pracoviště Hradec Králové (Úřad pro zastupování státu ve věcech majetkových),69797111,,,Smlouva o bezúplatném převodu pozemku  č. parc. 569/10 v k. ú. Zelené,https://smlouvy.gov.cz/smlouva/7525,
7337,2016-07-14T12:31:11+02:00,2016-07-01,Úřad práce České republiky,72496991,791262.52,792182.86,Nákup stravenek pro zaměstnance krajské pobočky,https://smlouvy.gov.cz/smlouva/7529,791722.69
7341,2016-07-14T12:32:35+02:00,2016-07-13,Město Nové Město na Moravě,00294900,16100.0,,"Směnná smlouva - převod z majetku města (p.č. 2738/5 v k.ú. NMNM), převod do majetku města (p.č.1442/27, 2738/6 v k.ú. NMNM)",https://smlouvy.gov.cz/smlouva/7533,16100.0
7345,2016-07-14T12:37:18+02:00,2016-05-24,Hasičský záchranný sbor Středočeského kraje,70885371,87700.0,106117.0,"Oprava vozidla AP 27 T815, RZ: PBA 09-94",https://smlouvy.gov.cz/smlouva/7537,96908.5
7349,2016-07-14T12:37:13+02:00,2016-01-04,Odborný léčebný ústav Jevíčko,00193976,60000.0,,rámcová smlouva o spolupráci,https://smlouvy.gov.cz/smlouva/7541,60000.0
7353,2016-07-14T12:39:34+02:00,2016-07-12,Úřad práce České republiky,72496991,,92800.0,Nákup poukázek pro výplatu dávek HN na kontaktním pracovišti v Táboře,https://smlouvy.gov.cz/smlouva/7545,92800.0
7357,2016-07-14T12:40:22+02:00,2016-07-13,Zdravotní ústav se sídlem v Ostravě,71009396,1950000.0,,Rámcová kupní smlouva - dodávky spotřebního materiálu pro filtraci vodných vzorků a rozbalovacího zařízení pro odvíjení filtračního materiálu v pásech,https://smlouvy.gov.cz/smlouva/7549,1950000.0
7361,2016-07-14T12:40:02+02:00,2014-04-07,"Základní škola Třebíč, Cyrilometodějská 22",47443936,,,Smlouva o připojení k distribuční soustavě -připojení  odběrného plynového zařízení  - pracoviště Zahradníčkova 842/23.,https://smlouvy.gov.cz/smlouva/7553,
7365,2016-07-14T12:40:02+02:00,2014-05-26,"Základní škola Třebíč, Cyrilometodějská 22",47443936,,3099.0,"Věcný dar v hodnotě Kč 3099,--Kč - trampolína",https://smlouvy.gov.cz/smlouva/7557,3099.0
7369,2016-07-14T12:40:03+02:00,2014-03-12,"Základní škola Třebíč, Cyrilometodějská 22",47443936,,,Poskytnutí práv k užívání elektronického nástroje E-ZAK.,https://smlouvy.gov.cz/smlouva/7561,
7373,2016-07-14T12:42:27+02:00,2016-06-27,Fakturace (Ministerstvo obrany),60162694,,98230.0,684820 - Autoinjektor 2-komorový,https://smlouvy.gov.cz/smlouva/7565,98230.0
7377,2016-07-14T12:47:16+02:00,2016-07-14,Thomayerova nemocnice,00064190,,,Dodávka ZM,https://smlouvy.gov.cz/smlouva/7573,
7381,2016-07-14T12:48:22+02:00,2016-07-13,Záchranný útvar HZS ČR,75152304,,60914375.7,Výpůjčka areálu Zbiroh,https://smlouvy.gov.cz/smlouva/7577,60914375.7
7385,2016-07-14T12:48:56+02:00,2016-07-14,Thomayerova nemocnice,00064190,,,Dodávka ZM,https://smlouvy.gov.cz/smlouva/7581,
7389,2016-07-14T12:48:57+02:00,2016-06-27,Fakturace (Ministerstvo obrany),60162694,,358191.0,684820 - Magnetoterapeutický přístroj 9 sad,https://smlouvy.gov.cz/smlouva/7585,358191.0
7393,2016-07-14T12:50:28+02:00,2016-07-14,Thomayerova nemocnice,00064190,,,Dodávka ZM,https://smlouvy.gov.cz/smlouva/7589,
7397,2016-07-14T12:50:03+02:00,2016-07-01,KruV - RS (Kraj Vysočina),70890749,,250000.0,"Poskytnutí dotace - Fond Vysočiny, GP Infrastruktura ICT 2016, FV01578.0028, projekt Strukturovaná kabeláž na budově internátu.",https://smlouvy.gov.cz/smlouva/7593,250000.0
7401,2016-07-14T12:52:28+02:00,2016-06-24,Krajské ředitelství policie Plzeňského kraje,75151529,1266851.0,1532889.71,"Výměna stř. krytiny - ALMA, Ž. Ruda, Jav",https://smlouvy.gov.cz/smlouva/7597,1399870.355
7405,2016-07-14T12:53:34+02:00,2016-07-13,"Nemocnice ve Frýdku-Místku, příspěvková organizace",00534188,,105711.65,objednávka léků,https://smlouvy.gov.cz/smlouva/7601,105711.65
7409,2016-07-14T12:53:01+02:00,2016-07-13,Město Nové Město na Moravě,00294900,433.0,,Pachtovní smlouva - propachtování p.č. 101 v k.ú. Studnice u Rokytna,https://smlouvy.gov.cz/smlouva/7605,433.0
7413,2016-07-14T12:53:44+02:00,2016-07-11,Statutární město Most,00266094,1200000.0,,"ostatní smlouvy, oprava povrchu stávající komunikace",https://smlouvy.gov.cz/smlouva/7609,1200000.0
7417,2016-07-14T12:55:00+02:00,2016-07-14,Město Moravské Budějovice,00289931,,7500.0,Licenční smlouva,https://smlouvy.gov.cz/smlouva/7613,7500.0
7421,2016-07-14T12:56:06+02:00,2016-07-13,Psychiatrická nemocnice v Dobřanech,00669792,55250.0,,kupní smlouva na dodávku obuvi,https://smlouvy.gov.cz/smlouva/7617,55250.0
7429,2016-07-14T12:56:58+02:00,2016-07-13,Úřad práce České republiky,72496991,,60000.0,Nákup ceninových poukázek pro výplatu dávek HN na kontaktním pracovišti v Prachaticích,https://smlouvy.gov.cz/smlouva/7625,60000.0
7433,2016-07-14T12:58:36+02:00,2016-06-30,Hasičský záchranný sbor Středočeského kraje,70885371,22000.0,26620.0,"D.č.1-Oprava vozidla AP 27 T815, RZ: PBA",https://smlouvy.gov.cz/smlouva/7629,24310.0
7437,2016-07-14T12:58:54+02:00,2016-07-14,"Gymnázium, Dobruška, Pulická 779",60884762,357080.0,452000.0,Rekonstrukce a modernizace školního sportoviště na Gymnáziu v Dobrušce - projekční práce,https://smlouvy.gov.cz/smlouva/7633,404540.0
7441,2016-07-14T12:59:31+02:00,2016-07-01,Městský obvod Vítkovice,00845451,,84700.0,Smlouva o dílo - zpracování projektových dokumentací na opravy v nebytových objektech,https://smlouvy.gov.cz/smlouva/7637,84700.0
7445,2016-07-14T13:00:42+02:00,2016-05-25,"Technické sítě Brno, akciová společnost",25512285,,,Rámcová smlouva - Provádění obnovy VO ve statutárním městě Brně,https://smlouvy.gov.cz/smlouva/7641,
7449,2016-07-14T13:01:30+02:00,2016-07-11,"Povodí Odry, státní podnik",70890021,,,Likvidace hrázek na vodních tocích,https://smlouvy.gov.cz/smlouva/7649,
7453,2016-07-14T13:06:29+02:00,2016-07-13,Úřad práce České republiky,72496991,,50000.0,Nákup kreditu do frankovacího stroje - kontaktní pracoviště Soběslav,https://smlouvy.gov.cz/smlouva/7653,50000.0
7457,2016-07-14T13:09:07+02:00,2016-07-13,Město Domažlice,00253316,,,vypracování projektové dokumentace na stavbu Rekonstrukce Sadové ulice v Domažlicích,https://smlouvy.gov.cz/smlouva/7657,
7461,2016-07-14T13:09:49+02:00,2016-07-14,Statutární město Havířov,00297488,480000.0,580800.0,SOD  aktualizace PD  chodník ul. Frýdecká,https://smlouvy.gov.cz/smlouva/7661,530400.0
7465,2016-07-14T13:10:02+02:00,2016-04-05,"Krajská správa a údržba silnic Vysočiny, příspěvková organizace",00090450,,181500.0,Kupní smlouva na kamenivo PDK 2/4,https://smlouvy.gov.cz/smlouva/7665,181500.0
7473,2016-07-14T13:12:55+02:00,2016-07-07,Město Domažlice,00253316,,,Oprava chodníků v ulici Erbenova v Domažlicích,https://smlouvy.gov.cz/smlouva/7673,
7477,2016-07-14T13:15:48+02:00,2016-07-04,Město Žamberk,00279846,182000.0,220220.0,objednávka projektová dokumentace,https://smlouvy.gov.cz/smlouva/7681,201110.0
7481,2016-07-14T13:16:27+02:00,2016-07-11,Ústecký kraj,70892156,,,dodatek č. 1 ke smlouvě č. 15/SML2719,https://smlouvy.gov.cz/smlouva/7685,
7485,2016-07-14T13:16:29+02:00,2016-07-14,Ústecký kraj,70892156,100000.0,100000.0,FÚK 2016_Smlouva o poskytnutí neinvestiční dotace,https://smlouvy.gov.cz/smlouva/7689,100000.0
7489,2016-07-14T13:15:55+02:00,2016-07-13,Ministerstvo zemědělství,00020478,410000.0,496100.0,"Uspořádání série seminářů včetně praktických ukázek pro ekologické i konvenční zemědělce na téma ""Finalizace bioprodukce a možnosti jejího odbytu"".",https://smlouvy.gov.cz/smlouva/7693,453050.0
7493,2016-07-14T13:16:59+02:00,2016-07-13,Fakultní nemocnice Brno,65269705,2849303.57,3134233.93,objednávka léků,https://smlouvy.gov.cz/smlouva/7697,2991768.75
7497,2016-07-14T13:19:59+02:00,2016-07-11,Thomayerova nemocnice,00064190,275200.0,,KS rychlouzavírací sášky,https://smlouvy.gov.cz/smlouva/7701,275200.0
7501,2016-07-14T13:20:02+02:00,2016-05-11,"Krajská správa a údržba silnic Vysočiny, příspěvková organizace",00090450,,10150.0,Kationaktivní asfaltová emulze 2016 část V - region Žďár nad Sázavou,https://smlouvy.gov.cz/smlouva/7705,10150.0
7505,2016-07-14T13:21:22+02:00,2016-07-14,Fakultní nemocnice Brno,65269705,4872146.51,5359361.16,objed návka léků,https://smlouvy.gov.cz/smlouva/7709,5115753.835
7513,2016-07-14T13:24:11+02:00,2016-07-11,Město Orlová,00297577,98200.0,118822.0,Aktualizace PD řešení stat. dopravy - realizace park. stání na I. a IV. etapě v O/Lutyni - 6 lokalit,https://smlouvy.gov.cz/smlouva/7717,108511.0
7517,2016-07-14T13:25:18+02:00,2016-07-14,Fakultní nemocnice Brno,65269705,128904.55,14795.0,dodávka léků,https://smlouvy.gov.cz/smlouva/7721,71849.775
7521,2016-07-14T13:25:09+02:00,2016-07-12,"Střední uměleckoprůmyslová škola sklářská, Železný Brod, Smetanovo zátiší 470, příspěvková organizace",60252766,68400.0,14364.0,dodávka šatních skříněk,https://smlouvy.gov.cz/smlouva/7725,41382.0
7525,2016-07-14T13:27:39+02:00,2016-07-13,Thomayerova nemocnice,00064190,,,objednávka léků,https://smlouvy.gov.cz/smlouva/7729,
7529,2016-07-14T13:30:27+02:00,2016-06-20,Městská část Praha 18,00231321,,182047.0,Oprava víceúčelového komunálního stroje Egholm 2200,https://smlouvy.gov.cz/smlouva/7733,182047.0
7533,2016-07-14T13:30:30+02:00,2016-06-27,Hasičský záchranný sbor Jihomoravského kraje,70884099,99328.0,120186.88,Hadice Technolen - Pyrotex C52 PES-R zás,https://smlouvy.gov.cz/smlouva/7737,109757.44
7537,2016-07-14T13:31:13+02:00,2016-07-01,TECHNICKÉ SLUŽBY HRADEC KRÁLOVÉ,64809447,958600.0,1159906.0,Oprava povrchu vozovky - Gočárova třída,https://smlouvy.gov.cz/smlouva/7741,1059253.0
7541,2016-07-14T13:33:28+02:00,2016-04-18,Krajské ředitelství policie Plzeňského kraje,75151529,14279.76,17278.51,"Výměna stř. krytiny - ALMA, Ž. Ruda, Jav",https://smlouvy.gov.cz/smlouva/7745,15779.134999999998
7545,2016-07-14T13:34:20+02:00,2016-07-01,Česká obchodní inspekce,00020869,,,Dodatek č. 2 k zápisu o užívání nebytových prostor ze dne 31.10. 2012,https://smlouvy.gov.cz/smlouva/7749,
7549,2016-07-14T13:36:50+02:00,2016-05-31,Město Zábřeh,00303640,,25000.0,Pronájem cvičné plochy,https://smlouvy.gov.cz/smlouva/7753,25000.0
7553,2016-07-14T13:37:40+02:00,2016-07-13,"Zoo Brno a stanice zájmových činností, příspěvková organizace",00101451,17249068.27,20871372.61,Smlouva o dílo - Výstavba provozního zázemí ZOO Brno - Expozice lvů,https://smlouvy.gov.cz/smlouva/7757,19060220.439999998
7561,2016-07-14T13:37:16+02:00,2009-06-30,Hasičský záchranný sbor Středočeského kraje,70885371,7947.9,9458.0,svoz komunálního odpadu - Řevnice,https://smlouvy.gov.cz/smlouva/7765,8702.95
7569,2016-07-14T13:40:41+02:00,2016-07-13,Technická univerzita v Liberci,46747885,74160.0,89734.0,Kupní smlouva na výpočetní techniku (3ks notebook),https://smlouvy.gov.cz/smlouva/7777,81947.0
7573,2016-07-14T13:44:41+02:00,2016-06-29,Hasičský záchranný sbor Jihomoravského kraje,70884099,82640.0,99994.4,Muflová pec L 15/12 Industry + přísluš.,https://smlouvy.gov.cz/smlouva/7781,91317.2
7577,2016-07-14T13:46:07+02:00,2015-04-13,Hasičský záchranný sbor Středočeského kraje,70885371,1623.97,1965.0,D1-svoz komunálního odpadu-Řevnice,https://smlouvy.gov.cz/smlouva/7785,1794.4850000000001
7581,2016-07-14T13:46:25+02:00,2016-07-14,Masarykova univerzita,00216224,65565.0,,Objednávka - oprava výtahu pavilon A2,https://smlouvy.gov.cz/smlouva/7789,65565.0
7585,2016-07-14T13:47:54+02:00,2016-07-04,Město Třinec,00297313,116800.0,,"Dodatek č. 1 ke Smlouvě o dílo - ""Dostavba nástupišť 4 zastávek na území města Třince""",https://smlouvy.gov.cz/smlouva/7793,116800.0
7589,2016-07-14T13:48:41+02:00,2016-07-08,Správa KRNAP,88455,90000.0,,Rámcová smlouva na zámečnické práce na venkovním vybavení Správy KRNAP,https://smlouvy.gov.cz/smlouva/7797,90000.0
7593,2016-07-14T13:50:18+02:00,2016-07-13,Město Prachatice,00250627,304000.0,367840.0,Smlouva o projektové a inženýrské činnosti,https://smlouvy.gov.cz/smlouva/7801,335920.0
7601,2016-07-14T13:51:54+02:00,2016-06-03,"Technické sítě Brno, akciová společnost",25512285,4301061.0,5204284.0,"Dílčí smlouva č. 1, Část veřejné zakázky č. 1",https://smlouvy.gov.cz/smlouva/7809,4752672.5
7605,2016-07-14T13:52:29+02:00,2016-07-11,"Dopravní podnik města Olomouce, a.s.",47676639,249091.0,301400.0,Nákup osobního vozidla,https://smlouvy.gov.cz/smlouva/7813,275245.5
7609,2016-07-14T13:52:34+02:00,2010-03-17,Správa uprchlických zařízení Ministerstva vnitra,60498021,153960.0,153960.0,"Nebytový prostor, ČB, Kněžskodvorská",https://smlouvy.gov.cz/smlouva/7817,153960.0
7613,2016-07-14T13:53:39+02:00,2016-07-12,Město Vizovice,00284653,,75611.1,kupní smlouva - stravenky,https://smlouvy.gov.cz/smlouva/7821,75611.1
7617,2016-07-14T13:57:48+02:00,2016-06-30,"Ústav struktury a mechaniky hornin AV ČR, v. v. i.",67985891,,,Pronájem prostor určených k podnikání v budovách AV,https://smlouvy.gov.cz/smlouva/7825,
7625,2016-07-14T13:59:14+02:00,2016-07-14,Ministerstvo zemědělství,00020478,,64977.0,"Stržení staré podlahové krytiny včetně její likvidace, úprava plochy pro pokládku a pokládka nové podlahové krytiny",https://smlouvy.gov.cz/smlouva/7833,64977.0
7629,2016-07-14T14:00:02+02:00,2016-07-08,KruV - RS (Kraj Vysočina),70890749,,110000.0,"Poskytnutí dotace v rámci POVV 2016, ID dotace ZZ01488.0444",https://smlouvy.gov.cz/smlouva/7837,110000.0
7633,2016-07-14T14:00:35+02:00,2016-07-11,Statutární město Pardubice,00274046,,78799.0,"TyfloCentrum Pardubice, o.p.s. - prostředky na náj",https://smlouvy.gov.cz/smlouva/7841,78799.0
7637,2016-07-14T14:01:39+02:00,2016-07-12,Správa a údržba silnic Pardubického kraje,00085031,6326162.76,,Rekonstrukce mostu ev.č. 371-005 Městečko Trnávka,https://smlouvy.gov.cz/smlouva/7845,6326162.76
7641,2016-07-14T14:01:18+02:00,2016-06-30,Hasičský záchranný sbor Středočeského kraje,70885371,,,D2-svoz komunálního odpadu-Řevnice,https://smlouvy.gov.cz/smlouva/7849,
7645,2016-07-14T14:01:03+02:00,2016-07-04,Státní ústav pro kontrolu léčiv,00023817,273500.0,273500.0,"Vypracování architektonické studie - Navýšení ceny o 18 000 Kč, celková cena tedy činí 273 500,- Kč",https://smlouvy.gov.cz/smlouva/7853,273500.0
7649,2016-07-14T14:05:45+02:00,2016-07-14,MĚSTO NÁCHOD,00272868,186074.0,,Částečná výměna rozvodů vody v I.a II.N.P   na krytém Plaveckém bazénu v Náchodě.,https://smlouvy.gov.cz/smlouva/7857,186074.0
7653,2016-07-14T14:05:08+02:00,2016-07-14,Městský obvod Vítkovice,00845451,750000.0,,Rámcová smlouva o díla č. TSB/0756/16-SD,https://smlouvy.gov.cz/smlouva/7861,750000.0
7657,2016-07-14T14:08:25+02:00,2016-07-13,Masarykova univerzita,00216224,91159.0,,Objednávka - opravy a údržba na tepelných zdrojích,https://smlouvy.gov.cz/smlouva/7865,91159.0
7661,2016-07-14T14:08:15+02:00,2016-07-13,Město Moravské Budějovice,00289931,,211130.0,Smlouva o dílo,https://smlouvy.gov.cz/smlouva/7869,211130.0
7665,2016-07-14T14:09:08+02:00,2016-07-08,Statutární město Havířov,00297488,97800.0,118338.0,TDS - MŠ Mládí,https://smlouvy.gov.cz/smlouva/7873,108069.0
7669,2016-07-14T14:09:23+02:00,2016-06-29,Město Jaroměř,00272728,161494.0,,Zhotovení kamenných prvků,https://smlouvy.gov.cz/smlouva/7877,161494.0
7673,2016-07-14T14:09:49+02:00,2016-07-01,Město Třinec,00297313,910050.5,,Dodatek č. 1 ke smlouvě o dílo - Přesun dětského hřiště Pastelka,https://smlouvy.gov.cz/smlouva/7881,910050.5
7677,2016-07-14T14:10:03+02:00,2016-07-08,KruV - RS (Kraj Vysočina),70890749,,110000.0,"Poskytnutí dotace v rámci POVV 2016, ID dotace ZZ01488.0645",https://smlouvy.gov.cz/smlouva/7885,110000.0
7681,2016-07-14T14:12:14+02:00,2012-06-27,Správa uprchlických zařízení Ministerstva vnitra,60498021,,,"Nebytový prostor, ČB, Kněžskodvorská",https://smlouvy.gov.cz/smlouva/7889,
7685,2016-07-14T14:12:08+02:00,2012-02-09,Správa uprchlických zařízení Ministerstva vnitra,60498021,,,"Nebytový prostor, ČB, Kněžskodvorská",https://smlouvy.gov.cz/smlouva/7893,
7689,2016-07-14T14:13:48+02:00,2016-07-14,"Mikrobiologický ústav AV ČR, v. v. i.",61388971,,,Smlouva o dílo - rekonstrukce prostor v budově GS,https://smlouvy.gov.cz/smlouva/7909,
7693,2016-07-14T14:13:15+02:00,2016-07-14,Statutární město Opava,00300535,71570.0,71570.0,kupní smlouva,https://smlouvy.gov.cz/smlouva/7917,71570.0
7697,2016-07-14T14:13:56+02:00,2011-06-06,statutární město Děčín,00261238,,420000.0,Smlouva o kontokorentním úvěru,https://smlouvy.gov.cz/smlouva/7921,420000.0
7701,2016-07-14T14:13:18+02:00,2010-06-22,statutární město Děčín,00261238,,420000.0,Smlouva o kontokorentním úvěru,https://smlouvy.gov.cz/smlouva/7925,420000.0
7705,2016-07-14T14:13:20+02:00,2016-07-14,Statutární město Opava,00300535,3650.0,4416.5,smlouva o zřízení věcného břemene,https://smlouvy.gov.cz/smlouva/7929,4033.25
7709,2016-07-14T14:13:38+02:00,2016-01-29,Správa KRNAP,88455,679650.0,,Smlouva o dílo na těžbu a přibližování dřevní hmoty,https://smlouvy.gov.cz/smlouva/7933,679650.0
7713,2016-07-14T14:14:56+02:00,2016-07-14,Thomayerova nemocnice,00064190,,,Dodávka ZM,https://smlouvy.gov.cz/smlouva/7937,
7717,2016-07-14T14:14:44+02:00,2016-07-14,Fakultní nemocnice Brno,65269705,87030.0,95733.0,dodávka léků,https://smlouvy.gov.cz/smlouva/7941,91381.5
7721,2016-07-14T14:14:23+02:00,2012-06-29,statutární město Děčín,00261238,,420000.0,Smlouva o kontokorentním úvěru,https://smlouvy.gov.cz/smlouva/7945,420000.0
7725,2016-07-14T14:14:43+02:00,2013-09-26,statutární město Děčín,00261238,,420000.0,Smlouva o kontokorentním úvěru,https://smlouvy.gov.cz/smlouva/7949,420000.0
7729,2016-07-14T14:15:06+02:00,2014-06-30,statutární město Děčín,00261238,,420000.0,Smlouva o kontokorentním úvěru,https://smlouvy.gov.cz/smlouva/7953,420000.0
7733,2016-07-14T14:15:32+02:00,2015-07-02,statutární město Děčín,00261238,,420000.0,Smlouva o kontokorentním úvěru,https://smlouvy.gov.cz/smlouva/7957,420000.0
7737,2016-07-14T14:15:55+02:00,2016-07-01,statutární město Děčín,00261238,,420000.0,Smlouva o kontokorentním úvěru,https://smlouvy.gov.cz/smlouva/7961,420000.0
7741,2016-07-14T14:16:30+02:00,2016-05-31,Město Mariánské Lázně,00254061,2050000.0,,Smlouva o nájmu nebytového prostoru,https://smlouvy.gov.cz/smlouva/7965,2050000.0
7745,2016-07-14T14:17:08+02:00,2016-07-12,Hlavní město Praha,00064581,46994.0,,Oprava poškozených stěn - služebna MP Praha 14,https://smlouvy.gov.cz/smlouva/7969,46994.0
7749,2016-07-14T14:17:22+02:00,2016-07-11,Hlavní město Praha,00064581,172971.0,,Výměna poškozených zátěžových koberců za linoleum,https://smlouvy.gov.cz/smlouva/7973,172971.0
7753,2016-07-14T14:17:28+02:00,2016-07-01,Hlavní město Praha,00064581,2700000.0,,Dodávky hodnostních značení na uniformy Městské policie hl m. Prahy - část B,https://smlouvy.gov.cz/smlouva/7977,2700000.0
7757,2016-07-14T14:18:14+02:00,2016-07-14,"Ředitelství silnic Zlínského kraje,příspěvková organizace",70934860,74380.0,90000.0,Provedení záchranného archeologického výzkumu při stavbě silnice II/495 Vlčnov-Uherský Brod,https://smlouvy.gov.cz/smlouva/7981,82190.0
7761,2016-07-14T14:19:46+02:00,2016-07-14,Fakultní nemocnice Brno,65269705,4520680.0,572748.0,dodávka léků,https://smlouvy.gov.cz/smlouva/7985,2546714.0
7765,2016-07-14T14:20:05+02:00,2016-07-11,KruV - RS (Kraj Vysočina),70890749,,110000.0,"Poskytnutí dotace v rámci POVV 2016, ID dotace ZZ01488.0632",https://smlouvy.gov.cz/smlouva/7989,110000.0
7769,2016-07-14T14:20:02+02:00,2016-07-07,KruV - RS (Kraj Vysočina),70890749,,110000.0,"Poskytnutí dotace v rámci POVV 2016, ID dotace ZZ01488.0630",https://smlouvy.gov.cz/smlouva/7993,110000.0
7773,2016-07-14T14:20:20+02:00,2016-07-14,Město Dobruška,00274879,68000.0,68000.0,Objednávka - zpracování studie na volnočasový areál,https://smlouvy.gov.cz/smlouva/7997,68000.0
7777,2016-07-14T14:20:03+02:00,2016-07-08,KruV - RS (Kraj Vysočina),70890749,,110000.0,"Poskytnutí dotace v rámci POVV 2016, ID dotace ZZ01488.0248",https://smlouvy.gov.cz/smlouva/8001,110000.0
7781,2016-07-14T14:20:04+02:00,2016-07-08,KruV - RS (Kraj Vysočina),70890749,,110000.0,"Poskytnutí dotace v rámci POVV 2016, ID dotace ZZ01488.0644",https://smlouvy.gov.cz/smlouva/8005,110000.0
7785,2016-07-14T14:20:04+02:00,2016-07-07,KruV - RS (Kraj Vysočina),70890749,,110000.0,"Poskytnutí dotace v rámci POVV 2016, ID dotace ZZ01488.0619",https://smlouvy.gov.cz/smlouva/8009,110000.0
7789,2016-07-14T14:22:00+02:00,2016-07-07,Královéhradecký kraj,70889546,,2000000.0,"Výstavba infrastruktury - kanalizace na p.p.č. 244/1, 244/6 a 237/3 v k.ú. Chvaleč",https://smlouvy.gov.cz/smlouva/8013,2000000.0
7793,2016-07-14T14:24:08+02:00,2015-08-07,Fakturace (Ministerstvo obrany),60162694,,493090.33,"210/2015-VA, Mimozáruční servis velkokuchyňského zařízení - RS,3. 2. - rozpis na rok 2016",https://smlouvy.gov.cz/smlouva/8017,493090.33
7797,2016-07-14T14:27:00+02:00,2016-01-15,Správa uprchlických zařízení Ministerstva vnitra,60498021,,,"Nebytový prostor, ČB, Kněžskodvorská",https://smlouvy.gov.cz/smlouva/8021,
7801,2016-07-14T14:27:33+02:00,2016-07-13,Český statistický úřad,00025593,69220.0,69220.0,Nákup stravenek ČSÚ České Budějovice červenec 2016,https://smlouvy.gov.cz/smlouva/8025,69220.0
7805,2016-07-14T14:28:13+02:00,2016-06-27,Město Mariánské Lázně,00254061,155520.0,,Smlouva o nájmu nebytového prostoru,https://smlouvy.gov.cz/smlouva/8029,155520.0
7809,2016-07-14T14:30:24+02:00,2016-06-30,Město Beroun,00233129,,20000.0,Veřejnoprávní smlouva o poskytnutí dotace z rozpočtu města Beroun,https://smlouvy.gov.cz/smlouva/8033,20000.0
7813,2016-07-14T14:30:02+02:00,2016-07-08,KruV - RS (Kraj Vysočina),70890749,,52000.0,"Poskytnutí dotace v rámci POVV 2016, ID dotace ZZ01488.0346",https://smlouvy.gov.cz/smlouva/8037,52000.0
7817,2016-07-14T14:30:04+02:00,2016-07-08,KruV - RS (Kraj Vysočina),70890749,,110000.0,"Poskytnutí dotace v rámci POVV 2016, ID dotace ZZ01488.0347",https://smlouvy.gov.cz/smlouva/8041,110000.0
7821,2016-07-14T14:30:05+02:00,2016-07-07,KruV - RS (Kraj Vysočina),70890749,,110000.0,"Poskytnutí dotace v rámci POVV 2016, ID dotace ZZ01488.0398",https://smlouvy.gov.cz/smlouva/8045,110000.0
7825,2016-07-14T14:31:00+02:00,2016-07-14,Město Jaroměř,00272728,168385.19,203746.08,Stavební úpravy v MŠ Na Zavadilce,https://smlouvy.gov.cz/smlouva/8049,186065.635
7829,2016-07-14T14:30:29+02:00,2016-07-13,Ministerstvo zemědělství,00020478,499972.0,499972.0,Provedení komplexní analýzy výchozí situace a možností pro zvýšení produkce biomasa v ČR a zjistit možnosti jeho zpracování a odbytu,https://smlouvy.gov.cz/smlouva/8053,499972.0
7833,2016-07-14T14:30:06+02:00,2016-07-14,KruV - RS (Kraj Vysočina),70890749,,50000.0,"dotace na realizaci aktivit spojených s uspořádáním letního dětského tábora pro nezletilé děti ze sociálně znevýhodněného prostředí, které jsou v současné době umístěny v zařízeních pro výkon ústavní výchovy v Kraji Vysočina, ID dotace O01780.0001",https://smlouvy.gov.cz/smlouva/8057,50000.0
7837,2016-07-14T14:30:03+02:00,2016-07-08,KruV - RS (Kraj Vysočina),70890749,,110000.0,"Poskytnutí dotace v rámci POVV 2016, ID dotace ZZ01488.0288",https://smlouvy.gov.cz/smlouva/8061,110000.0
7841,2016-07-14T14:30:04+02:00,2016-07-08,KruV - RS (Kraj Vysočina),70890749,,110000.0,"Poskytnutí dotace v rámci POVV 2016, ID dotace ZZ01488.0291",https://smlouvy.gov.cz/smlouva/8065,110000.0
7849,2016-07-14T14:32:25+02:00,2016-07-14,Městská část Praha 19,00231304,160000.0,160000.0,VÝKUPNÍ SMLOUVA OSOBNÍHO VOZU,https://smlouvy.gov.cz/smlouva/8073,160000.0
7857,2016-07-14T14:34:41+02:00,2016-03-29,"Povodí Ohře, státní podnik",70889988,799195.27,,VD Skalka - DH - oprava a rekonstrukce,https://smlouvy.gov.cz/smlouva/8081,799195.27
7861,2016-07-14T14:35:20+02:00,2016-07-14,Thomayerova nemocnice,00064190,,,OBJEDNÁVKA ZDR. MATERIÁLU,https://smlouvy.gov.cz/smlouva/8085,
7865,2016-07-14T14:36:12+02:00,2016-07-08,Hasičský záchranný sbor Jihomoravského kraje,70884099,59812.0,72372.52,PS Blansko stavební opravy dílny CHS,https://smlouvy.gov.cz/smlouva/8089,66092.26000000001
