id,zverejneni,uzavreni,subjekt,ico,bezdph,sdph,predmet,odkaz,cena
9,2016-07-01T01:17:36+02:00,2016-06-30,Liberecký kraj,70891508,80000.0,,rozšíření jádra IS Ginis o funkcionalitu zveřejňování smluv,https://smlouvy.gov.cz/smlouva/9,80000.0
13,2016-07-01T05:57:34+02:00,2016-06-28,"Zdravotnická záchranná služba Olomouckého kraje, příspěvková organizace",00849103,91308.0,,Podnájmní smlouva,https://smlouvy.gov.cz/smlouva/13,91308.0
17,2016-07-01T06:05:23+02:00,2016-06-27,"Zdravotnická záchranná služba Olomouckého kraje, příspěvková organizace",00849103,,,Podnájemní smlouva,https://smlouvy.gov.cz/smlouva/17,
21,2016-07-01T06:09:05+02:00,2016-06-01,"Zdravotnická záchranná služba Olomouckého kraje, příspěvková organizace",00849103,,,Smlouva o sdružených službách dodávka zemního plynu,https://smlouvy.gov.cz/smlouva/21,
25,2016-07-01T06:38:46+02:00,2016-06-14,"Zdravotnická záchranná služba Zlínského kraje, příspěvková organizace",62182137,,,Nájem nebytových prostor,https://smlouvy.gov.cz/smlouva/25,
37,2016-07-01T07:36:00+02:00,2012-07-24,Hlavní město Praha,00064581,,,Licence SW produktů,https://smlouvy.gov.cz/smlouva/37,
45,2016-07-01T07:54:39+02:00,2016-07-04,"Odborné učiliště Cvrčovice, příspěvková organizace",60680300,168415.41,203782.0,Smlouva o dílo,https://smlouvy.gov.cz/smlouva/45,186098.70500000002
49,2016-07-01T07:54:36+02:00,2013-01-02,Hlavní město Praha,00064581,,,služby spočívající v poskytování podpory a údržby programového vybavení - sml. prodloužena dodatkem č. 1,https://smlouvy.gov.cz/smlouva/49,
53,2016-07-01T08:10:11+02:00,2016-05-04,Fakturace (Ministerstvo obrany),60162694,3600000.0,3600000.0,"LAND ROVER OLOMOUC - Servis, údržba a opravy vozidel kategorie M1 a N1 2016-2019 III (část 3)",https://smlouvy.gov.cz/smlouva/53,3600000.0
57,2016-07-01T08:15:07+02:00,2015-10-27,Fakturace (Ministerstvo obrany),60162694,4000000.0,4000000.0,"ŠKODA a VW TÁBOR - část VZ č. 1 - Servis, údržba a opravy vozidel kategorie M1, N1 2015 - 2018 II",https://smlouvy.gov.cz/smlouva/57,4000000.0
61,2016-07-01T08:15:40+02:00,2015-02-19,Fakturace (Ministerstvo obrany),60162694,81000000.0,81000000.0,Kancelářské potřeby 2015-2016,https://smlouvy.gov.cz/smlouva/61,81000000.0
65,2016-07-01T08:22:16+02:00,2016-04-04,Fakturace (Ministerstvo obrany),60162694,,,"Dodatek č. 1 - ŠKODA a VW TÁBOR - část VZ č. 1 - Servis, údržba a opravy vozidel kategorie M1, N1 2015 - 2018 II",https://smlouvy.gov.cz/smlouva/65,
69,2016-07-01T08:39:05+02:00,2015-06-30,Fakturace (Ministerstvo obrany),60162694,11320000.0,11320000.0,"KAROSA, SOR a MERCEDES BRNO - část č. 4 VZ - OŘ Autobus - opravy a udržování 2015-2018",https://smlouvy.gov.cz/smlouva/69,11320000.0
73,2016-07-01T08:39:37+02:00,2015-07-22,Fakturace (Ministerstvo obrany),60162694,11320000.0,11320000.0,KAROSA a SOR OLOMOUC - část č. 5 VZ - OŘ Autobus - opravy a udržování 2015-2018,https://smlouvy.gov.cz/smlouva/73,11320000.0
77,2016-07-01T08:41:11+02:00,2015-07-22,Fakturace (Ministerstvo obrany),60162694,24360000.0,24360000.0,Autobusy různých značek PRAHA - část č. 1 VZ - OŘAutobus - opravy a udržování 2015-2018,https://smlouvy.gov.cz/smlouva/77,24360000.0
81,2016-07-01T08:50:33+02:00,2016-06-10,Fakturace (Ministerstvo obrany),60162694,3600000.0,3600000.0,"Startovací elektrické akumulátory pro bojovou vojenskou techniku AČR ""T-72- BVP"" (část 1)",https://smlouvy.gov.cz/smlouva/81,3600000.0
85,2016-07-01T08:53:29+02:00,2016-06-10,Fakturace (Ministerstvo obrany),60162694,4400000.0,4400000.0,"Startovací elektrické akumulátory pro bojovou vojenskou techniku AČR ""T-72- BVP"" (část 2)",https://smlouvy.gov.cz/smlouva/85,4400000.0
89,2016-07-01T08:53:51+02:00,2016-06-10,Fakturace (Ministerstvo obrany),60162694,31500000.0,31500000.0,Startovací elektrické akumulatory pro vojenská vozidla AČR (část 3),https://smlouvy.gov.cz/smlouva/89,31500000.0
97,2016-07-01T09:14:26+02:00,2016-04-12,Fakturace (Ministerstvo obrany),60162694,39798699.6,39798699.6,Očkovací látky 2016-2018 (část 1),https://smlouvy.gov.cz/smlouva/97,39798699.6
101,2016-07-01T09:16:10+02:00,2016-04-12,Fakturace (Ministerstvo obrany),60162694,954000.0,954000.0,Očkovací látky 2016-2018 (část 2),https://smlouvy.gov.cz/smlouva/101,954000.0
109,2016-07-01T09:17:50+02:00,2016-04-12,Fakturace (Ministerstvo obrany),60162694,475000.0,475000.0,Očkovací látky 2016-2018 (část 3),https://smlouvy.gov.cz/smlouva/109,475000.0
113,2016-07-01T09:34:42+02:00,2016-05-20,Fakturace (Ministerstvo obrany),60162694,2705560.0,2705560.0,Medaile a rezortní vyznamenání 2016-2018,https://smlouvy.gov.cz/smlouva/113,2705560.0
117,2016-07-01T09:38:58+02:00,2015-04-17,Fakturace (Ministerstvo obrany),60162694,4500000.0,4500000.0,"FORD OLOMOUC - část VZ č. 8 - Servis, údržba a opravy vozidel kategorie M1, N1 2015-2018",https://smlouvy.gov.cz/smlouva/117,4500000.0
121,2016-07-01T09:53:06+02:00,2015-05-13,Fakturace (Ministerstvo obrany),60162694,3200000.0,3200000.0,"FORD PRAHA - část VZ č. 6 - Servis, údržba a opravy vozidel kategorie M1, N1 2015-2018",https://smlouvy.gov.cz/smlouva/121,3200000.0
125,2016-07-01T09:55:18+02:00,2016-07-01,"Mikrobiologický ústav AV ČR, v. v. i.",61388971,,,Kupní smlouva - pultový hlubokomrazící  box,https://smlouvy.gov.cz/smlouva/125,
129,2016-07-01T09:55:12+02:00,2015-05-13,Fakturace (Ministerstvo obrany),60162694,6000000.0,6000000.0,"BMW PRAHA - část VZ č. 12 - Servis, údržba a opravy vozidel kategorie M1, N1 2015-2018",https://smlouvy.gov.cz/smlouva/129,6000000.0
133,2016-07-01T09:57:15+02:00,2015-05-13,Fakturace (Ministerstvo obrany),60162694,8400000.0,8400000.0,"MERCEDES PRAHA - část VZ č. 13 - Servis, údržba aopravy vozidel kategorie M1, N1 2015-2018",https://smlouvy.gov.cz/smlouva/133,8400000.0
137,2016-07-01T09:58:46+02:00,2015-07-09,Fakturace (Ministerstvo obrany),60162694,26340000.0,26340000.0,"ŠKODA a VW PRAHA - část č VZ č. 1 - Servis, údržba a opravy vozidel kategorie M1, N1 2015-2018",https://smlouvy.gov.cz/smlouva/137,26340000.0
141,2016-07-01T10:00:32+02:00,2015-06-12,Fakturace (Ministerstvo obrany),60162694,3300000.0,3300000.0,"FORD TÁBOR - část VZ č. 7 - Servis, údržba a opravy vozidel kategorie M1, N1 2015-2018",https://smlouvy.gov.cz/smlouva/141,3300000.0
145,2016-07-01T10:03:02+02:00,2015-06-19,Fakturace (Ministerstvo obrany),60162694,8620000.0,8620000.0,"LAND ROVER PRAHA - část VZ č. 9 - Servis, údržba a opravy vozidel kategorie M1, N1 2015-2018",https://smlouvy.gov.cz/smlouva/145,8620000.0
149,2016-07-01T10:04:13+02:00,2015-06-19,Fakturace (Ministerstvo obrany),60162694,18000000.0,18000000.0,"TOYOTA PRAHA - část VZ č. 11 - Servis, údržba a opravy vozidel kategorie M1, N1 2015-2018",https://smlouvy.gov.cz/smlouva/149,18000000.0
153,2016-07-01T10:05:24+02:00,2016-01-01,"Mateřská škola speciální, Ústí nad Labem, Štefánikova 761, příspěvková organizace",70229457,,,Dodávka elektřiny v rámci sdružených služeb dodávky elektřiny v napěťové hladině nízkého napětí,https://smlouvy.gov.cz/smlouva/153,
157,2016-07-01T10:05:43+02:00,2016-01-21,Fakturace (Ministerstvo obrany),60162694,6720000.0,6720000.0,"KAROSA PARDUBICE - část č. 2 VZ - II. OŘ Autobusy- servis, údržba a opravy 2015-2018",https://smlouvy.gov.cz/smlouva/157,6720000.0
161,2016-07-01T10:06:20+02:00,2016-01-22,Fakturace (Ministerstvo obrany),60162694,6280000.0,6280000.0,"KAROSA BECHYNĚ - část č. 1 VZ - II. OŘ Autobusy -servis, údržba a opravy 2015-2018",https://smlouvy.gov.cz/smlouva/161,6280000.0
165,2016-07-01T10:08:45+02:00,2015-06-11,Fakturace (Ministerstvo obrany),60162694,8500000.0,8500000.0,Zabezpečení polygrafické výroby pro rezort MO,https://smlouvy.gov.cz/smlouva/165,8500000.0
169,2016-07-01T10:09:51+02:00,2016-05-27,Fakturace (Ministerstvo obrany),60162694,17040000.0,17040000.0,"ŠKODA a VW OLOMOUC - Servis, údržba a opravy vozidel kategorie M1 a N1 2016-2019 III (část 2)",https://smlouvy.gov.cz/smlouva/169,17040000.0
173,2016-07-01T10:16:33+02:00,2016-06-30,"Vincentinum - poskytovatel sociálních služeb Šternberk, příspěvková organizace",75004429,,,Smlouva o poskytování stravování,https://smlouvy.gov.cz/smlouva/173,
181,2016-07-01T10:22:49+02:00,2016-02-09,Město Přeštice,00257125,285000.0,285000.0,dotační (i rozhodnutí) - Smlouva o poskytnutí účelové dotace určené na zajištění dopravní obslužnosti území Plzeňského kraje v roce 2016,https://smlouvy.gov.cz/smlouva/177,285000.0
185,2016-07-01T10:23:17+02:00,2015-10-22,Fakturace (Ministerstvo obrany),60162694,4860000.0,4860000.0,"ŠKODA a VW PARDUBICE - část VZ č. 3 - Servis, údržba a opravy vozidel kategorie M1, N1 2015 - 2018 II",https://smlouvy.gov.cz/smlouva/181,4860000.0
189,2016-07-01T10:24:23+02:00,2015-10-22,Fakturace (Ministerstvo obrany),60162694,2400000.0,2400000.0,"RENAULT PARDUBICE - část VZ č. 6 - Servis, údržbaa opravy vozidel kategorie M1, N1 2015 - 2018 II",https://smlouvy.gov.cz/smlouva/185,2400000.0
193,2016-07-01T10:24:29+02:00,2016-06-23,"ČEPRO, a.s.",60193531,,,Smlouva o nákupu a užití produktů Sodexo,https://smlouvy.gov.cz/smlouva/189,
197,2016-07-01T10:25:12+02:00,2016-06-23,"ČEPRO, a.s.",60193531,4199999.0,,Provedení repasí 2 vozidel CAS 32 na podvozku Tatra T 815,https://smlouvy.gov.cz/smlouva/197,4199999.0
201,2016-07-01T10:27:11+02:00,2016-07-01,Liberecký kraj,70891508,63600.0,,"Smlouva o poskytnutí dotace - ""Dokončení zázemí hasičárny Předlánce, oprava podlahy Hasičárna Višňová",https://smlouvy.gov.cz/smlouva/201,63600.0
205,2016-07-01T10:33:42+02:00,2016-06-27,Masarykova univerzita,00216224,1048000.0,,Kupní smlouva - Dodávka serverů pro FI MU,https://smlouvy.gov.cz/smlouva/213,1048000.0
209,2016-07-01T10:35:51+02:00,2015-12-22,Fakturace (Ministerstvo obrany),60162694,263005.6,263005.6,Předání nebezpečného odpadu jiné oprávněné osobě v roce 2016 -2017,https://smlouvy.gov.cz/smlouva/217,263005.6
213,2016-07-01T10:40:09+02:00,2016-06-21,Město Aš,00253901,6930000.0,8385300.0,Smlouva o dílo - protipožární opatření objektu laRitma v Aši,https://smlouvy.gov.cz/smlouva/221,7657650.0
221,2016-07-01T10:44:23+02:00,2016-07-01,"Armádní Servisní, příspěvková organizace",60460580,199500.0,241395.0,Připojení mikrovlnným spojem P2P,https://smlouvy.gov.cz/smlouva/229,220447.5
229,2016-07-01T10:51:24+02:00,2016-07-01,Český statistický úřad,00025593,2337420.0,2828278.2,"Předmětem smlouvy o poskytování úklidových služeb a dodávkách hygienického materiálu v budově ústředí ČSÚ je poskytování úklidových služeb v budově ústředí ČSÚ v Praze 10, Na padesátém 3268/81 a dodávka hygienického materiálu.",https://smlouvy.gov.cz/smlouva/237,2582849.1
233,2016-07-01T10:52:07+02:00,2016-02-16,Fakturace (Ministerstvo obrany),60162694,,,Dodatek č. 1 - Autobusy různých značek PRAHA - část č. 1 VZ - OŘ Autobus - opravy a udržování 2015-2018,https://smlouvy.gov.cz/smlouva/241,
237,2016-07-01T10:53:09+02:00,2016-06-29,Město Žďár nad Sázavou,00295841,449720.0,,smlouva uzavřená ve smyslu § 1746/2 z.č. 89/2012,https://smlouvy.gov.cz/smlouva/245,449720.0
241,2016-07-01T10:54:23+02:00,2015-12-31,Fakturace (Ministerstvo obrany),60162694,,,Dodatek č. 1 - KAROSA a SOR OLOMOUC - část č. 5 VZ - OŘ Autobus - opravy a udržování 2015-2018,https://smlouvy.gov.cz/smlouva/249,
245,2016-07-01T10:55:11+02:00,2015-12-31,Fakturace (Ministerstvo obrany),60162694,,,"Dodatek č. 1 - KAROSA, SOR a MERCEDES BRNO - částč. 4 VZ - OŘ Autobus - opravy a udržování 2015-2018",https://smlouvy.gov.cz/smlouva/253,
249,2016-07-01T10:55:35+02:00,2016-02-16,Fakturace (Ministerstvo obrany),60162694,,,"Dodatek č. 2 - KAROSA, SOR a MERCEDES BRNO - částč. 4 VZ - OŘ Autobus - opravy a udržování 2015-2018",https://smlouvy.gov.cz/smlouva/257,
253,2016-07-01T10:56:43+02:00,2016-06-30,Město Hodkovice nad Mohelkou,00262820,50000.0,60500.0,Studie revitalizece koupaliště,https://smlouvy.gov.cz/smlouva/261,55250.0
257,2016-07-01T11:11:54+02:00,2016-06-30,"Domov Vítkov, příspěvková organizace",71196951,,107940.0,objednávka - záclony,https://smlouvy.gov.cz/smlouva/265,107940.0
261,2016-07-01T11:11:21+02:00,2015-12-22,Fakturace (Ministerstvo obrany),60162694,81796.0,81796.0,Předání ostatního odpadu (biologicky rozložitelnýodpad) jiné oprávněné osobě v roce 2016 -2017,https://smlouvy.gov.cz/smlouva/269,81796.0
265,2016-07-01T11:12:28+02:00,2016-06-20,Fakturace (Ministerstvo obrany),60162694,80000.0,80000.0,Rámcová smlouva -. servis a opravy kopírovacích zařízení,https://smlouvy.gov.cz/smlouva/273,80000.0
269,2016-07-01T11:13:34+02:00,2016-02-15,Město Sokolov,00259586,,,Smlouva o užití Ortofota ČR,https://smlouvy.gov.cz/smlouva/277,
277,2016-07-01T11:23:48+02:00,2016-05-18,Město Vsetín,00304450,,,smlouva o zřízení služebnosti inženýrské sítě,https://smlouvy.gov.cz/smlouva/285,
281,2016-07-01T11:28:02+02:00,2016-06-27,"Střední odborné učiliště elektrotechnické, Plzeň, Vejprnická 56",69456330,,,Mandátní smlouva o provádění služeb v oblasti BOZP,https://smlouvy.gov.cz/smlouva/289,
285,2016-07-01T11:30:11+02:00,2016-04-01,Fakturace (Ministerstvo obrany),60162694,,,"Dodatek č. 1 - RENAULT PARDUBICE - část VZ č. 6 -Servis, údržba a opravy vozidel kategorie M1, N1 2015 - 2018 II",https://smlouvy.gov.cz/smlouva/293,
289,2016-07-01T11:34:17+02:00,2010-09-06,STATUTÁRNÍ MĚSTO LIBEREC,00262978,,,Smlouva o poskytování služeb v oblasti veřejně dostupné služby elektronických komunikací,https://smlouvy.gov.cz/smlouva/297,
293,2016-07-01T11:35:41+02:00,2016-07-01,"Zdravotnická záchranná služba Zlínského kraje, příspěvková organizace",62182137,,,zajišťování výkonu stomatologické pohotovostní služby,https://smlouvy.gov.cz/smlouva/301,
297,2016-07-01T11:39:14+02:00,2016-07-01,"Armádní Servisní, příspěvková organizace",60460580,84000.0,,pyrotechnický průzkum ve vojenském prostoru u obce Město Libavá,https://smlouvy.gov.cz/smlouva/305,84000.0
301,2016-07-01T11:40:51+02:00,2016-07-01,Technická univerzita v Liberci,46747885,329880.0,399154.8,poskytování komplexních služeb BOZP a PO,https://smlouvy.gov.cz/smlouva/309,364517.4
305,2016-07-01T11:44:08+02:00,2016-07-01,MSK registr smluv (Moravskoslezský kraj),70890692,,300000.0,"Smlouva o poskytnutí dotace z rozpočtu MSK - 69. Mezinárodní folklorní setkání ""Gorolski Świeto""",https://smlouvy.gov.cz/smlouva/313,300000.0
309,2016-07-01T11:46:11+02:00,2016-06-29,Město Nové Město na Moravě,00294900,,,úprava pracovně právních podmínek a nároků zaměstnanců města Nové Město na Moravě v období od 1.7.2016 do 30.6.2020,https://smlouvy.gov.cz/smlouva/317,
313,2016-07-01T11:49:08+02:00,2016-07-01,Liberecký kraj,70891508,,77500.0,Smlouva o poskytnutí dotace - Nákup ochranných prostředků,https://smlouvy.gov.cz/smlouva/321,77500.0
317,2016-07-01T11:49:10+02:00,2016-07-01,Liberecký kraj,70891508,,72754.0,Smlouva o poskytnutí dotace - Dýchací technika,https://smlouvy.gov.cz/smlouva/325,72754.0
321,2016-07-01T11:49:44+02:00,2016-07-01,Liberecký kraj,70891508,,135000.0,Smlouva o poskytnutí dotace - Dokončení rekonstrukce hasičské zbrojnice,https://smlouvy.gov.cz/smlouva/329,135000.0
325,2016-07-01T11:56:46+02:00,2015-04-30,Univerzita Karlova v Praze,00216208,1999000.0,,"1.LFUK OVZ 2015L-0023 rámcová smlouva o dílo, Přeprava těl zemřelých určených pro potřeby vědy",https://smlouvy.gov.cz/smlouva/333,1999000.0
329,2016-07-01T11:58:20+02:00,2016-07-01,MSK registr smluv (Moravskoslezský kraj),70890692,,100000.0,Smlouva o poskytnutí dotace z rozpočtu Moravskoslezského kraje - Dotace Vodní záchranná služba ČČK Těrlicko,https://smlouvy.gov.cz/smlouva/337,100000.0
337,2016-07-01T12:10:34+02:00,2016-06-23,Město Semily,00276111,500000.0,500000.0,Smlouva o dotaci_dotace na zajištění akcí Dožínkové slavnosti „Semilský pecen“ 2017 - 2021,https://smlouvy.gov.cz/smlouva/345,500000.0
341,2016-07-01T12:13:54+02:00,2016-07-01,Liberecký kraj,70891508,,77515.0,Smlouva o poskytnutí dotace -,https://smlouvy.gov.cz/smlouva/349,77515.0
345,2016-07-01T12:17:57+02:00,2016-05-23,Statutární město Karviná,00297534,1779785.0,,"Kupní smlouva - počítače, notebooky, monitory",https://smlouvy.gov.cz/smlouva/353,1779785.0
349,2016-07-01T12:31:40+02:00,2016-07-01,"1. Mateřská škola Karlovy Vary, Komenského 7, příspěvková organizace",71237003,,,prodej potravinářského zboží,https://smlouvy.gov.cz/smlouva/357,
353,2016-07-01T12:32:18+02:00,2016-07-01,"1. Mateřská škola Karlovy Vary, Komenského 7, příspěvková organizace",71237003,,,prodej potravinářského zboží,https://smlouvy.gov.cz/smlouva/361,
357,2016-07-01T12:32:49+02:00,2016-07-01,"1. Mateřská škola Karlovy Vary, Komenského 7, příspěvková organizace",71237003,,,prodej potravinářského zboží,https://smlouvy.gov.cz/smlouva/365,
365,2016-07-01T12:33:10+02:00,2016-07-01,"1. Mateřská škola Karlovy Vary, Komenského 7, příspěvková organizace",71237003,,,prodej potravinářského zboží,https://smlouvy.gov.cz/smlouva/373,
369,2016-07-01T12:34:57+02:00,2016-04-13,Státní fond životního prostředí České republiky,00020729,355000.0,429550.0,Smlouva o účasti na Veletrhu Brno 2016,https://smlouvy.gov.cz/smlouva/377,392275.0
373,2016-07-01T12:42:54+02:00,2016-07-01,Město Mikulov,00283347,295744.0,357850.24,pronájem prostor podnikání v objektu č.p. 1769,https://smlouvy.gov.cz/smlouva/381,326797.12
377,2016-07-01T12:49:02+02:00,2016-07-01,Statutární město Havířov,00297488,242800.0,293788.0,Objednávka 72_ORG_16,https://smlouvy.gov.cz/smlouva/385,268294.0
381,2016-07-01T12:52:44+02:00,2016-07-01,Liberecký kraj,70891508,,69000.0,Smlouva o poskytnutí dotace - Výměna oken a dveří v HZ,https://smlouvy.gov.cz/smlouva/389,69000.0
385,2016-07-01T12:56:42+02:00,2016-04-12,Fakturace (Ministerstvo obrany),60162694,544800.0,544800.0,Očkovací látky 2016-2018 (část 4),https://smlouvy.gov.cz/smlouva/393,544800.0
389,2016-07-01T12:58:16+02:00,2015-02-03,Fakturace (Ministerstvo obrany),60162694,45000000.0,45000000.0,LAND ROVER - opravy a udržování  (Geryková),https://smlouvy.gov.cz/smlouva/397,45000000.0
393,2016-07-01T13:06:05+02:00,2015-07-09,Fakturace (Ministerstvo obrany),60162694,,,dodatek č. 1,https://smlouvy.gov.cz/smlouva/401,
397,2016-07-01T13:08:23+02:00,2016-06-06,Fakturace (Ministerstvo obrany),60162694,,,dodatek č. 3,https://smlouvy.gov.cz/smlouva/405,
401,2016-07-01T13:10:12+02:00,2014-12-17,Fakturace (Ministerstvo obrany),60162694,81122854.01,81122854.01,Automobil pancéřový IVECO - náhradní díly,https://smlouvy.gov.cz/smlouva/409,81122854.01
405,2016-07-01T13:15:29+02:00,2016-07-01,Integrovaná střední škola - Centrum odborné přípravy a Jazyková škola s právem státní jazykové zkoušky Valašské Meziříčí,00851574,160000.0,193600.0,Příkazní smlouva,https://smlouvy.gov.cz/smlouva/413,176800.0
409,2016-07-01T13:14:59+02:00,2016-07-01,Liberecký kraj,70891508,,60000.0,Smlouva o poskytnutí dotace - Nákup ochranných prostředků PO,https://smlouvy.gov.cz/smlouva/417,60000.0
413,2016-07-01T13:15:01+02:00,2016-07-01,Liberecký kraj,70891508,,50000.0,Smlouva o poskytnutí dotace - Nákup věcných prostředků pro JSDHO Jablonec n. N.,https://smlouvy.gov.cz/smlouva/421,50000.0
417,2016-07-01T13:16:44+02:00,2015-08-10,Fakturace (Ministerstvo obrany),60162694,20000000.0,20000000.0,Zabezpečení životního cyklu PPLRK RBS-70,https://smlouvy.gov.cz/smlouva/425,20000000.0
421,2016-07-01T13:19:45+02:00,2016-07-01,Liberecký kraj,70891508,,53980.0,Smlouva o poskytnutí dotace - Pořízení přetlakové dýchací techniky,https://smlouvy.gov.cz/smlouva/429,53980.0
425,2016-07-01T13:21:30+02:00,2016-07-01,Městská část Praha 3,00063517,,,Smlouva o uzavření budoucí smlouvy o zřízení věcného břemene,https://smlouvy.gov.cz/smlouva/433,
429,2016-07-01T13:33:28+02:00,2016-07-01,Zdravotní ústav se sídlem v Ústí nad Labem,71009361,,157400.0,Dodávka diagnostik,https://smlouvy.gov.cz/smlouva/437,157400.0
433,2016-07-01T13:41:30+02:00,2016-07-01,Město Rychnov nad Kněžnou,00275336,100000.0,,Smlouva o poskytnutí finančního příspěvku,https://smlouvy.gov.cz/smlouva/441,100000.0
437,2016-07-01T13:42:42+02:00,2016-07-01,"Mikrobiologický ústav AV ČR, v. v. i.",61388971,,,Kupní smlouva - Centrifuga 5810 R s příslušenstvím,https://smlouvy.gov.cz/smlouva/445,
441,2016-07-01T13:43:12+02:00,2016-07-01,Liberecký kraj,70891508,,57000.0,Smlouva o poskytnutí dotace - Pořízení garážových vrat,https://smlouvy.gov.cz/smlouva/449,57000.0
445,2016-07-01T13:43:14+02:00,2016-07-01,Liberecký kraj,70891508,,59895.0,Smlouva o poskytnutí dotace - Pořízení sekčních vrat do HZ,https://smlouvy.gov.cz/smlouva/453,59895.0
449,2016-07-01T13:43:16+02:00,2016-07-01,Liberecký kraj,70891508,,57000.0,Smlouva o poskytnutí dotace -,https://smlouvy.gov.cz/smlouva/457,57000.0
453,2016-07-01T13:43:19+02:00,2016-07-01,Liberecký kraj,70891508,,55000.0,Smlouva o poskytnutí dotace - Nákup požární motorové stříkačky,https://smlouvy.gov.cz/smlouva/461,55000.0
457,2016-07-01T13:42:43+02:00,2016-06-13,Olomoucký kraj,60609460,,15651350.0,"Smlouva o dílo na realizaci stavby „Slovanské gymnázium, Olomouc, tř. Jiřího z Poděbrad 13 - Elektroinstalace a modernizace počítačové sítě, objekt Pasteurova ulice“",https://smlouvy.gov.cz/smlouva/465,15651350.0
461,2016-07-01T13:44:56+02:00,2016-06-29,Město Žďár nad Sázavou,00295841,159000.0,,smlouva uzavřená dle § 1746/2 z.č. 89/2012,https://smlouvy.gov.cz/smlouva/469,159000.0
465,2016-07-01T13:46:47+02:00,2016-06-28,TS a.s.,60793716,,,Dodávka obalovaných asfaltobetonových směsí,https://smlouvy.gov.cz/smlouva/473,
469,2016-07-01T13:54:13+02:00,2016-07-01,"Firemní školka města Ostravy, příspěvková organizace",71294155,,,Smlouva o zabezpečení dovozu stravy pro mateřskou školu,https://smlouvy.gov.cz/smlouva/477,
473,2016-07-01T13:56:06+02:00,2016-01-19,"Městské lesy Chomutov, příspěvková organizace",46790080,9523200.0,11523072.0,Tato rámcová smlouva upravuje podmínky plnění dílčích veřejných zakázek na provedení lesnických prací v roce 2016 a způsob zadávání těchto zakázek jednotlivým zhotovitelům,https://smlouvy.gov.cz/smlouva/481,10523136.0
477,2016-07-01T13:57:41+02:00,2016-07-01,Dopravní podnik měst Chomutova a Jirkova a.s.,64053466,,236200.0,Objednávka - stravenky,https://smlouvy.gov.cz/smlouva/485,236200.0
485,2016-07-01T14:03:42+02:00,2016-07-01,"Firemní školka města Ostravy, příspěvková organizace",71294155,,,Zveřejnění záznamu v registru smluv - zavodni stravovani,https://smlouvy.gov.cz/smlouva/497,
497,2016-07-01T14:09:26+02:00,2016-05-02,"Technické sítě Brno, akciová společnost",25512285,2579929.52,3121715.0,Kupní smlouva č. 5/2016,https://smlouvy.gov.cz/smlouva/505,2850822.26
501,2016-07-01T14:09:49+02:00,2016-07-01,Liberecký kraj,70891508,,56536.2,Smlouva o poskytnutí dotace - Výměna vchodových dveří a garážových vrat,https://smlouvy.gov.cz/smlouva/509,56536.2
505,2016-07-01T14:09:51+02:00,2016-07-01,Liberecký kraj,70891508,,50000.0,Smlouva o poskytnutí dotace -,https://smlouvy.gov.cz/smlouva/513,50000.0
509,2016-07-01T14:10:25+02:00,2016-07-01,Liberecký kraj,70891508,,50763.0,Smlouva o poskytnutí dotace - Nákup ochranných prostředků PO,https://smlouvy.gov.cz/smlouva/517,50763.0
525,2016-07-01T14:54:51+02:00,2016-07-01,"Knihovna AV ČR, v. v. i.",67985971,110839.84,111251.41,objednávka stravenky 0716,https://smlouvy.gov.cz/smlouva/521,111045.625
529,2016-07-01T14:56:11+02:00,2016-07-01,"Ústav molekulární genetiky AV ČR, v. v. i.",68378050,,292063.75,Objednávka,https://smlouvy.gov.cz/smlouva/525,292063.75
533,2016-07-01T15:04:08+02:00,2016-06-30,Středočeský kraj - rejstřík smluv (Středočeský kraj),70891095,,469117.0,Kupní smlouva - nákup WinPro 10 SNGL (10 balíčků po 10 licencích),https://smlouvy.gov.cz/smlouva/529,469117.0
537,2016-07-01T15:05:19+02:00,2016-07-29,"Zdravotnická záchranná služba Libereckého kraje, příspěvková organizace",46744991,,39480.0,výroba nábytku,https://smlouvy.gov.cz/smlouva/533,39480.0
541,2016-07-01T15:07:49+02:00,2016-05-30,"Zdravotnická záchranná služba Libereckého kraje, příspěvková organizace",46744991,,42713.1,oprava vozidla,https://smlouvy.gov.cz/smlouva/537,42713.1
545,2016-07-01T15:10:39+02:00,2016-06-29,Město Hodkovice nad Mohelkou,00262820,45188.0,57200.0,zpracování průkazů energetické náročnosti budov,https://smlouvy.gov.cz/smlouva/541,51194.0
549,2016-07-01T15:23:07+02:00,2016-06-30,Státní zdravotní ústav se sídlem v Praze,75010330,289861.0,350732.0,Dodávka osobního vozu,https://smlouvy.gov.cz/smlouva/545,320296.5
557,2016-07-01T19:24:59+02:00,2015-01-13,Univerzita Karlova v Praze,00216208,1304188.3,,"1.LF UK OVZ 2015K-0001 rámcová kupní smlouva, dodávky drogistického zboží, úklidových a čisticích prostředků",https://smlouvy.gov.cz/smlouva/553,1304188.3
561,2016-07-01T19:24:31+02:00,2016-05-10,Univerzita Karlova v Praze,00216208,1360000.0,,"1.LFUK OVZ Rámcová kupní smlouva 2016K-0002, dodávka podestýlky pro laboratorní zvířata",https://smlouvy.gov.cz/smlouva/557,1360000.0
577,2016-07-03T19:47:36+02:00,2016-06-02,Město Odolena Voda,00240559,,,Darovací smlouva,https://smlouvy.gov.cz/smlouva/573,
581,2016-07-03T20:18:14+02:00,2016-04-25,Město Odolena Voda,00240559,,,Smlouva o poskytování servisních služeb – ČOV,https://smlouvy.gov.cz/smlouva/577,
585,2016-07-03T20:27:34+02:00,2016-04-25,Město Odolena Voda,00240559,,,Smlouva o poskytování služeb – odvoz a likvidace kalů – ČOV,https://smlouvy.gov.cz/smlouva/581,
