id,zverejneni,uzavreni,subjekt,ico,bezdph,sdph,predmet,odkaz,cena
2261,2016-07-11T11:31:22+02:00,2016-06-30,Liberecký kraj,70891508,115748.0,,Smlouva o poskytnutí účelové dotace z programu Kotlíkové dotace v Libereckém kraji,https://smlouvy.gov.cz/smlouva/2329,115748.0
2265,2016-07-11T11:31:24+02:00,2016-06-30,Liberecký kraj,70891508,112500.0,,Smlouva o poskytnutí účelové dotace z programu Kotlíkové dotace v Libereckém kraji,https://smlouvy.gov.cz/smlouva/2333,112500.0
2269,2016-07-11T11:31:26+02:00,2016-07-07,Regionální rada regionu soudržnosti Jihozápad,75086999,107190.0,107229.9,Objednávka stravenky 06 2016,https://smlouvy.gov.cz/smlouva/2337,107209.95
2273,2016-07-11T11:32:24+02:00,2016-07-01,Hlavní město Praha,00064581,137866.0,304658.0,"krátkodobý podnájem a užívání telefonních linek Operátor ICT, a.s.",https://smlouvy.gov.cz/smlouva/2341,221262.0
2277,2016-07-11T11:33:37+02:00,2016-06-30,Liberecký kraj,70891508,92250.0,,Smlouva o poskytnutí účelové dotace z programu Kotlíkové dotace v Libereckém kraji,https://smlouvy.gov.cz/smlouva/2345,92250.0
2281,2016-07-11T11:37:02+02:00,2016-07-11,Thomayerova nemocnice,00064190,,,Dodávka ZM,https://smlouvy.gov.cz/smlouva/2349,
2285,2016-07-11T11:38:19+02:00,2016-07-04,"Střední odborná škola a Střední odborné učiliště, Česká Lípa, 28. října 2707, příspěvková organizace",14451018,330000.0,399300.0,Oprava příjezdové komunikace v areálu školy,https://smlouvy.gov.cz/smlouva/2357,364650.0
2289,2016-07-11T11:38:48+02:00,2016-07-11,Thomayerova nemocnice,00064190,,,Dodávka ZM,https://smlouvy.gov.cz/smlouva/2361,
2297,2016-07-11T11:49:37+02:00,2016-06-30,Liberecký kraj,70891508,118400.0,,Smlouva o poskytnutí účelové dotace z programu Kotlíkové dotace v Libereckém kraji,https://smlouvy.gov.cz/smlouva/2369,118400.0
2301,2016-07-11T11:49:39+02:00,2016-06-30,Liberecký kraj,70891508,112500.0,,Smlouva o poskytnutí účelové dotace z programu Kotlíkové dotace v Libereckém kraji,https://smlouvy.gov.cz/smlouva/2373,112500.0
2305,2016-07-11T11:49:41+02:00,2016-06-30,Liberecký kraj,70891508,105750.0,,Smlouva o poskytnutí účelové dotace z programu Kotlíkové dotace v Libereckém kraji,https://smlouvy.gov.cz/smlouva/2377,105750.0
2309,2016-07-11T11:52:10+02:00,2016-07-08,"Technické služby města Chomutova, příspěvková organizace",00079065,82644.63,100000.0,Kupní smlouva,https://smlouvy.gov.cz/smlouva/2381,91322.315
2313,2016-07-11T11:53:38+02:00,2016-07-11,Jihomoravský kraj,70888337,,138109.0,"SLU - (dílo), péče o zvláště chráněná území",https://smlouvy.gov.cz/smlouva/2385,138109.0
2317,2016-07-11T11:54:24+02:00,2016-07-04,Město Horní Slavkov,00259322,2716486.23,3286948.34,Smlouva o dílo - systém odděleného sběru odpadů - kontejnerová stání,https://smlouvy.gov.cz/smlouva/2389,3001717.285
2321,2016-07-11T11:58:49+02:00,2016-06-30,Liberecký kraj,70891508,120000.0,,Smlouva o poskytnutí účelové dotace z programu Kotlíkové dotace v Libereckém kraji,https://smlouvy.gov.cz/smlouva/2393,120000.0
2325,2016-07-11T11:58:55+02:00,2016-06-30,Liberecký kraj,70891508,120000.0,,Smlouva o poskytnutí účelové dotace z programu Kotlíkové dotace v Libereckém kraji,https://smlouvy.gov.cz/smlouva/2397,120000.0
2329,2016-07-11T12:02:35+02:00,2016-07-08,Masarykova univerzita,00216224,188405.9,,Kupní smlouva - Laboratorní mikroskop,https://smlouvy.gov.cz/smlouva/2401,188405.9
2333,2016-07-11T12:04:01+02:00,2016-07-07,"Česká pošta, s.p.",47114983,1852000.0,,zpracovatel: Jitka Michálková,https://smlouvy.gov.cz/smlouva/2405,1852000.0
2337,2016-07-11T12:05:03+02:00,2016-07-07,"Česká pošta, s.p.",47114983,1852000.0,,zpracovatel: Jitka Michálková,https://smlouvy.gov.cz/smlouva/2409,1852000.0
2341,2016-07-11T12:18:43+02:00,2016-06-30,Liberecký kraj,70891508,70910.0,,Smlouva o poskytnutí účelové dotace z programu Kotlíkové dotace v Libereckém kraji,https://smlouvy.gov.cz/smlouva/2413,70910.0
2345,2016-07-11T12:18:27+02:00,2016-06-30,Liberecký kraj,70891508,105000.0,,Smlouva o poskytnutí účelové dotace z programu Kotlíkové dotace v Libereckém kraji,https://smlouvy.gov.cz/smlouva/2417,105000.0
2349,2016-07-11T12:18:35+02:00,2016-06-30,Liberecký kraj,70891508,88672.5,,Smlouva o poskytnutí účelové dotace z programu Kotlíkové dotace v Libereckém kraji,https://smlouvy.gov.cz/smlouva/2421,88672.5
2353,2016-07-11T12:18:37+02:00,2016-06-30,Liberecký kraj,70891508,102400.0,,Smlouva o poskytnutí účelové dotace z programu Kotlíkové dotace v Libereckém kraji,https://smlouvy.gov.cz/smlouva/2425,102400.0
2357,2016-07-11T12:18:45+02:00,2016-07-07,"Základní škola Český Krumlov, Plešivec 249",00583740,385868.0,466900.0,"Výměna stávajících rozvodů vody v ZŠ Český Krumlov, Plešivec 249",https://smlouvy.gov.cz/smlouva/2429,426384.0
2361,2016-07-11T12:25:29+02:00,2016-07-08,"Gymnázium, Vlašim, Tylova 271",61664545,1004357.0,1215272.0,Stavební práce,https://smlouvy.gov.cz/smlouva/2433,1109814.5
2365,2016-07-11T12:29:00+02:00,2016-06-30,Liberecký kraj,70891508,120000.0,,Smlouva o poskytnutí účelové dotace z programu Kotlíkové dotace v Libereckém kraji,https://smlouvy.gov.cz/smlouva/2437,120000.0
2369,2016-07-11T12:29:02+02:00,2016-06-30,Liberecký kraj,70891508,105000.0,,Smlouva o poskytnutí účelové dotace z programu Kotlíkové dotace v Libereckém kraji,https://smlouvy.gov.cz/smlouva/2441,105000.0
2373,2016-07-11T12:34:21+02:00,2016-06-29,Liberecký kraj,70891508,400000.0,,Smlouva o poskytnutí účelové neinvestiční dotace,https://smlouvy.gov.cz/smlouva/2445,400000.0
2381,2016-07-11T12:53:05+02:00,2016-07-11,Fakultní nemocnice Brno,65269705,659984.55,725983.0,objednávka léky,https://smlouvy.gov.cz/smlouva/2453,692983.775
2385,2016-07-11T12:55:09+02:00,2016-07-11,Masarykův onkologický ústav,00209805,59500.0,71995.0,"Předmětem smlouvy je závazek zhotovitele zpracovat dotazníky z výzkumu spokojenosti pacientů, vyhodnocení výsledků podle kritérií dimenzí kvality zdravotní péče a zpracování závěrečné zprávy",https://smlouvy.gov.cz/smlouva/2457,65747.5
2389,2016-07-11T12:55:10+02:00,2016-07-11,statutární město Děčín,00261238,,423500.0,Smlouva o dílo,https://smlouvy.gov.cz/smlouva/2461,423500.0
2393,2016-07-11T12:55:57+02:00,2016-06-01,statutární město Děčín,00261238,,,Smlouva o dopravě - Labská plavební společnost s.r.o.,https://smlouvy.gov.cz/smlouva/2465,
2397,2016-07-11T12:57:02+02:00,2016-07-01,"MAME Moravské Budějovice, s.r.o.",25570161,,,Dodatek č. 6 ke Smlouvě o nájmu nebytových prostor a o dodávkách služeb do nebytových prostor,https://smlouvy.gov.cz/smlouva/2469,
2401,2016-07-11T13:06:46+02:00,2012-12-19,Město Písek,00249998,4599996.0,,Smlouva o poskytnutí a zajištění činností a poskytnutí příspěvku na činnost,https://smlouvy.gov.cz/smlouva/2473,4599996.0
2405,2016-07-11T13:08:01+02:00,2016-06-29,"Ředitelství silnic Zlínského kraje,příspěvková organizace",70934860,,197973.0,Nájemní smlouva,https://smlouvy.gov.cz/smlouva/2477,197973.0
2409,2016-07-11T13:09:31+02:00,2016-07-11,Masarykův onkologický ústav,00209805,65500.0,79255.0,závazek zhotovitele provést zpracování dotazníků z výzkumu kvality pracovního života zaměstnanců objednatele,https://smlouvy.gov.cz/smlouva/2481,72377.5
2413,2016-07-11T13:14:19+02:00,2016-07-11,Fakultní nemocnice Brno,65269705,,,objednávka léky,https://smlouvy.gov.cz/smlouva/2485,
2417,2016-07-11T13:15:01+02:00,2016-07-01,"DIAMO, státní podnik",00002739,158160.0,,Osvětlení a klimatizace místností,https://smlouvy.gov.cz/smlouva/2489,158160.0
2421,2016-07-11T13:21:35+02:00,2016-06-29,"Ředitelství silnic Zlínského kraje,příspěvková organizace",70934860,,,Smlouva o výpůjčce,https://smlouvy.gov.cz/smlouva/2497,
2425,2016-07-11T13:24:31+02:00,2016-06-28,"Základní škola Nové Město na Moravě, Vratislavovo nám. 124, okres Žďár nad Sázavou",70284725,,,Kupní smlouva na dodávky potravin pro školní jídelny,https://smlouvy.gov.cz/smlouva/2501,
2429,2016-07-11T13:25:16+02:00,2016-07-11,Fakultní nemocnice Brno,65269705,980080.58,1078088.64,objuednávka léky,https://smlouvy.gov.cz/smlouva/2505,1029084.6099999999
2433,2016-07-11T13:30:32+02:00,2016-07-08,Ústecký kraj,70892156,356000.0,426560.0,"16/SML/3575/INV/99/PD,IČ+AD - SŠ zahr. a zem. A.E. Komerse. Děčín - Libverda - rekonstrukce toalet",https://smlouvy.gov.cz/smlouva/2509,391280.0
2437,2016-07-11T13:33:28+02:00,2016-07-07,Masarykův onkologický ústav,00209805,49683.69,,Dodávka zdravotnického materiálu,https://smlouvy.gov.cz/smlouva/2517,49683.69
2441,2016-07-11T13:33:05+02:00,2016-06-29,Liberecký kraj,70891508,100000.0,,Smlouva o poskytnutí účelové neinvestiční dotace,https://smlouvy.gov.cz/smlouva/2521,100000.0
2445,2016-07-11T13:33:31+02:00,2016-06-24,Fakturace (Ministerstvo obrany),60162694,,453777.83,"Nákup konektorů, krytek, kabelů, pásek a vývodek",https://smlouvy.gov.cz/smlouva/2525,453777.83
2449,2016-07-11T13:35:41+02:00,2016-07-07,Masarykův onkologický ústav,00209805,145086.31,,Dodávka léčivých přípravků,https://smlouvy.gov.cz/smlouva/2529,145086.31
2453,2016-07-11T13:36:50+02:00,2016-07-08,Masarykův onkologický ústav,00209805,153697.19,,Dodávka léčivých přípravků,https://smlouvy.gov.cz/smlouva/2533,153697.19
2457,2016-07-11T13:40:10+02:00,2016-06-30,Liberecký kraj,70891508,5464056.64,,"14_Dodatek č.1 OLP/312/2016 Rekonstrukce WC, elektrotechniky a ZT Gymnázium a SOŠ Jilemnice",https://smlouvy.gov.cz/smlouva/2537,5464056.64
2461,2016-07-11T13:43:36+02:00,2016-07-04,"Základní škola Roztoky, Školní náměstí 470, 252 63 Roztoky, okr. Praha západ",70854963,,,Dodání konvektomatu a stavební úpravy školní jídelny související s jeho instalací,https://smlouvy.gov.cz/smlouva/2541,
2465,2016-07-11T13:45:10+02:00,2016-04-01,Fakturace (Ministerstvo obrany),60162694,,488197.49,"8660 - RS Nákup ochranných pomůcek, oděvů a obuvipro příslušníky VHJ",https://smlouvy.gov.cz/smlouva/2545,488197.49
2469,2016-07-11T13:50:44+02:00,2016-07-07,"Česká pošta, s.p.",47114983,98280.0,,Objednávka známek Gerrit Dou - společné česko-lichtenštejnské vydání.,https://smlouvy.gov.cz/smlouva/2549,98280.0
2473,2016-07-11T13:56:52+02:00,2016-07-11,Fakultní nemocnice Brno,65269705,,,FN Brno - Rekonstrukce havarij. rozvodů vody v objektu L,https://smlouvy.gov.cz/smlouva/2553,
2477,2016-07-11T13:57:29+02:00,2016-06-29,Liberecký kraj,70891508,105000.0,,Smlouva o poskytnutí účelové neinvestiční dotace,https://smlouvy.gov.cz/smlouva/2557,105000.0
2481,2016-07-11T13:58:00+02:00,2016-07-04,"Základní škola Roztoky, Školní náměstí 470, 252 63 Roztoky, okr. Praha západ",70854963,,,"Rekonstrukce vnitřního dvora ZŠ Roztoky, okres Praha-západ, pracoviště Žalov",https://smlouvy.gov.cz/smlouva/2561,
2489,2016-07-11T14:01:20+02:00,2016-07-01,Česká centrála cestovního ruchu-Czechtourism,49277600,2960000.0,3581600.0,Zajištění propagace České republiky v rámci festivalu Colours of Ostrava a konference Czech Music Crossroads 2017,https://smlouvy.gov.cz/smlouva/2569,3270800.0
2497,2016-07-11T14:01:19+02:00,2016-07-08,Česká centrála cestovního ruchu-Czechtourism,49277600,495868.0,600000.0,"Předmětem této smlouvy je zajištění propagace České republiky v rámci festivalu Colours of Ostrava a festivalu a konference Czech Music Crossroads, které se uskuteční v Ostravě.",https://smlouvy.gov.cz/smlouva/2577,547934.0
2509,2016-07-11T14:07:39+02:00,2016-06-29,Liberecký kraj,70891508,100000.0,,Smlouva o poskytnutí účelové neinvestiční dotace,https://smlouvy.gov.cz/smlouva/2589,100000.0
2513,2016-07-11T14:16:15+02:00,2016-07-12,Město Blovice,00256455,549599.0,665014.79,Smlouva o dílo - Výdejní pult s příslušenstvím pro školní jídelnu ZŠ Blovice,https://smlouvy.gov.cz/smlouva/2593,607306.895
2517,2016-07-11T14:17:59+02:00,2016-07-07,Správa Pražského hradu,49366076,70665.0,85504.7,Kupní smlouva,https://smlouvy.gov.cz/smlouva/2597,78084.85
2521,2016-07-11T14:23:04+02:00,2016-07-08,Thomayerova nemocnice,00064190,71181.1,86043.6,OBJEDNÁVKA ZDRAV. MATERIÁLU,https://smlouvy.gov.cz/smlouva/2601,78612.35
2533,2016-07-11T14:30:02+02:00,2016-07-08,KruV - RS (Kraj Vysočina),70890749,,,"Dohoda o ukončení smlouvy o dílo na akci ""Obchodní akademie a Hotelová škola Třebíč - rekonstrukce DM T. Bati""",https://smlouvy.gov.cz/smlouva/2613,
2537,2016-07-11T14:30:10+02:00,2016-07-11,Fakultní nemocnice Brno,65269705,659984.55,725983.0,Objednávka léků,https://smlouvy.gov.cz/smlouva/2617,692983.775
2541,2016-07-11T14:30:11+02:00,2016-06-29,Liberecký kraj,70891508,105000.0,,Smlouva o poskytnutí účelové neinvestiční dotace,https://smlouvy.gov.cz/smlouva/2621,105000.0
2545,2016-07-11T14:30:03+02:00,2016-03-16,KruV - RS (Kraj Vysočina),70890749,,13856674.38,"akce ""Obchodní akademie a Hotelová škola Třebíč - rekonstrukce DM T. Bati""
EZAK 183/2015",https://smlouvy.gov.cz/smlouva/2625,13856674.38
2549,2016-07-11T14:30:38+02:00,2016-04-10,Město Písek,00249998,1129950.0,,Smlouva o poskytování služeb,https://smlouvy.gov.cz/smlouva/2629,1129950.0
2553,2016-07-11T14:37:20+02:00,2016-07-11,Fakultní nemocnice Brno,65269705,,,Objednávka diagnostik,https://smlouvy.gov.cz/smlouva/2633,
2557,2016-07-11T14:37:19+02:00,2016-06-29,Liberecký kraj,70891508,125000.0,,Smlouva o poskytnutí účelové neinvestiční dotace,https://smlouvy.gov.cz/smlouva/2637,125000.0
2561,2016-07-11T14:39:08+02:00,2015-08-26,Fakturace (Ministerstvo obrany),60162694,,,dodatek č. 2,https://smlouvy.gov.cz/smlouva/2641,
2565,2016-07-11T14:40:46+02:00,2016-07-01,"Městský dopravní podnik Opava, a.s.",64610250,115999.0,,Kupní smlouva,https://smlouvy.gov.cz/smlouva/2645,115999.0
2577,2016-07-11T14:42:37+02:00,2016-07-08,"Českomoravská záruční a rozvojová banka, a.s.",44848943,1686156.0,,Smlouva o dílo - realizace chlazení kanceláří,https://smlouvy.gov.cz/smlouva/2657,1686156.0
2585,2016-07-11T14:45:51+02:00,2016-07-08,Liberecký kraj,70891508,,901666.7,Smlouva o poskytnutí dotace -,https://smlouvy.gov.cz/smlouva/2665,901666.7
2589,2016-07-11T14:49:06+02:00,2016-07-09,Liberecký kraj,70891508,60000.0,,"Ruční kosení a likvidace invazní střemchy pozdní a dalších dřevin do výšky 2m, k.ú. Kuřívody",https://smlouvy.gov.cz/smlouva/2669,60000.0
2593,2016-07-11T14:52:12+02:00,2016-07-12,Regionální pracoviště Ústecko (Agentura ochrany přírody a krajiny České republiky),62933591,55000.0,66550.0,Pastva na Odolickém vrchu,https://smlouvy.gov.cz/smlouva/2677,60775.0
2601,2016-07-11T15:12:10+02:00,2016-07-11,"Správa nemovitostí Hradec Králové, příspěvková organizace",64811069,1550436.55,,stavební / udržovací práce na stavebním objektu,https://smlouvy.gov.cz/smlouva/2693,1550436.55
2605,2016-07-11T15:13:02+02:00,2016-07-07,Fakturace (Ministerstvo obrany),60162694,,121000.0,Nákup vodících lišt solárních plachet,https://smlouvy.gov.cz/smlouva/2697,121000.0
2609,2016-07-11T15:13:29+02:00,2016-07-08,Fakturace (Ministerstvo obrany),60162694,,64637.98,Nákup měřící techniky,https://smlouvy.gov.cz/smlouva/2701,64637.98
2613,2016-07-11T15:17:42+02:00,2016-07-07,Město Šumperk,00303461,,208000.0,PD - Rekonstrukce silnoproudých elektroinstalací v objektu Kina Oko v Šumperku,https://smlouvy.gov.cz/smlouva/2709,208000.0
2617,2016-07-11T15:24:59+02:00,2016-07-07,Obec Tuchlovice,00235041,1165298.64,1410011.35,Úprava vzájemnýcgh práv a povinností smluvních stran při provedení stavebních prací,https://smlouvy.gov.cz/smlouva/2721,1287654.995
2621,2016-07-11T15:24:29+02:00,2016-07-08,Český statistický úřad,00025593,84181.82,101860.0,Nákup stravenek pro KS ČSÚ Brno - červenec 2016,https://smlouvy.gov.cz/smlouva/2725,93020.91
2625,2016-07-11T15:24:46+02:00,2016-07-11,Město Bílovec,00297755,807300.0,976833.0,Pořízení produkčního a záložního serveru včetně řešení zálohování,https://smlouvy.gov.cz/smlouva/2729,892066.5
2633,2016-07-11T15:30:05+02:00,2014-01-24,Fakturace (Ministerstvo obrany),60162694,,4200000.0,"21/2014-KR, RS, Nákup PHM v roce 2014 pomocí platebních karet Benzina , T004/14V/00001851, 16.2. - oprava dodavatele - UNIPETROL ( od 1.1. 2016 fúze s Benzinou )",https://smlouvy.gov.cz/smlouva/2737,4200000.0
2653,2016-07-11T15:48:39+02:00,2016-07-11,Město Domažlice,00253316,,,"vypracování projektové dokumentace pro stavební povolení na stavbu ""Oprava mostu M-08 Domažlice""",https://smlouvy.gov.cz/smlouva/2757,
2657,2016-07-11T15:49:35+02:00,2016-07-08,Liberecký kraj,70891508,,800000.0,Smlouva o poskytnutí dotace - Přístavba a rekonstrukce hasičské zbrojnice,https://smlouvy.gov.cz/smlouva/2761,800000.0
2665,2016-07-11T15:49:43+02:00,2016-07-08,Liberecký kraj,70891508,,300000.0,Smlouva o poskytnutí dotace - Pořízení dopravního automobilu,https://smlouvy.gov.cz/smlouva/2769,300000.0
2669,2016-07-11T15:52:42+02:00,2016-06-29,Záchranný útvar HZS ČR,75152304,,591600.0,Střežení a recepce areálu Hať,https://smlouvy.gov.cz/smlouva/2773,591600.0
2701,2016-07-11T16:07:20+02:00,2016-07-08,Liberecký kraj,70891508,300000.0,,Smlouva o poskytnutí dotace - Pořízení dopravního automobilu,https://smlouvy.gov.cz/smlouva/2805,300000.0
2709,2016-07-11T16:12:15+02:00,2016-07-01,ČESKÝ ROZHLAS,45245053,53321.0,,"Dílčí smlouva o poskytování služeb Servisní prohlídky, údržba, opravy, havarijní opravy, kontroly VZT zařízení včetně rozvodů pro VZT v komplexu ČRo Praha 2",https://smlouvy.gov.cz/smlouva/2813,53321.0
2713,2016-07-11T16:18:51+02:00,2016-07-01,Město Nová Paka,00271888,,125000.0,Objednávka kreditu do frankovacího stroje,https://smlouvy.gov.cz/smlouva/2817,125000.0
2717,2016-07-11T16:21:15+02:00,2016-07-08,Liberecký kraj,70891508,300000.0,,Smlouva o poskytnutí dotace - Pořízení dopravního automobilu,https://smlouvy.gov.cz/smlouva/2821,300000.0
2721,2016-07-11T16:24:37+02:00,2016-06-23,Město Hostinné,00277908,93122.58,,"Smlouva o dílo ""Oprava střechy objektu posilovny čp. 752 v ulici Boženy Němcové""",https://smlouvy.gov.cz/smlouva/2825,93122.58
2725,2016-07-11T16:27:49+02:00,2016-07-08,Liberecký kraj,70891508,300000.0,,Smlouva o poskytnutí dotace - Pořízení dopravního automobilu,https://smlouvy.gov.cz/smlouva/2829,300000.0
2729,2016-07-11T16:30:09+02:00,2016-07-01,Domov pod hradem Žampach,00854271,260000.0,308300.0,Objednávka nového vozidla Lodgy Artica 7 míst,https://smlouvy.gov.cz/smlouva/2833,284150.0
2733,2016-07-11T16:31:13+02:00,2016-06-28,Statutární město Pardubice,00274046,308499.79,373284.74,Dodatek č. 1 smlouvy o dílo 46/15 - rekonstrukce chodníků v ul. Přeloučská ve Starých Čív. - MIROS,https://smlouvy.gov.cz/smlouva/2837,340892.265
2737,2016-07-11T16:34:16+02:00,2015-01-01,Fakturace (Ministerstvo obrany),60162694,,203000.18,"562/2014-FO, RS, Praní a chemické čištění prádla v období  2015 - 2017  , T004/14V/00047083 - 21.1.- financování na rok 2016",https://smlouvy.gov.cz/smlouva/2841,203000.18
2741,2016-07-11T16:34:35+02:00,2016-07-08,Liberecký kraj,70891508,300000.0,,Smlouva o poskytnutí dotace - Nákup požárního vozidla,https://smlouvy.gov.cz/smlouva/2845,300000.0
2745,2016-07-11T16:37:29+02:00,2016-07-04,Domov pod hradem Žampach,00854271,100000.0,,Rámcová kupní smlouva - dodávky potravinářského zboží,https://smlouvy.gov.cz/smlouva/2849,100000.0
2749,2016-07-11T16:47:30+02:00,2016-07-11,MĚSTO BROUMOV,00272523,,,Smlouva o kontokorentním úvěru,https://smlouvy.gov.cz/smlouva/2853,
2753,2016-07-11T16:48:49+02:00,2016-07-11,Moravská galerie v Brně,00094871,600000.0,726000.0,Výroba fóliového písma a grafiky řezané plotrem včetně nalepení,https://smlouvy.gov.cz/smlouva/2857,663000.0
2757,2016-07-11T16:50:02+02:00,2016-07-11,KruV - RS (Kraj Vysočina),70890749,,8000.0,Finanční příspěvek na hospodaření v lesích ZZ00905-16.0068,https://smlouvy.gov.cz/smlouva/2861,8000.0
2761,2016-07-11T16:50:03+02:00,2016-07-11,KruV - RS (Kraj Vysočina),70890749,,18720.0,Finanční příspěvek na hospodaření v lesích ZZ00905-16.0106,https://smlouvy.gov.cz/smlouva/2865,18720.0
2765,2016-07-11T16:53:06+02:00,2016-07-11,"Nemocnice Milosrdných bratří, příspěvková organizace",48512478,16299.0,18743.0,Objednávka potravin,https://smlouvy.gov.cz/smlouva/2869,17521.0
2769,2016-07-11T16:54:52+02:00,2016-07-08,Statutární město Opava,00300535,226020.0,2734810.0,smlouva o nájmu prostoru sloužícího podnikání,https://smlouvy.gov.cz/smlouva/2873,1480415.0
2773,2016-07-11T17:00:03+02:00,2016-07-11,KruV - RS (Kraj Vysočina),70890749,,29440.0,Finanční příspěvek na hospodaření v lesích ZZ00905-17.0060,https://smlouvy.gov.cz/smlouva/2877,29440.0
2777,2016-07-11T17:00:03+02:00,2016-07-11,KruV - RS (Kraj Vysočina),70890749,,16950.0,Finanční příspěvek na hospodaření v lesích ZZ00905-17.0034,https://smlouvy.gov.cz/smlouva/2881,16950.0
2781,2016-07-11T17:00:03+02:00,2016-07-11,KruV - RS (Kraj Vysočina),70890749,,10660.0,Finanční příspěvek na hospodaření v lesích ZZ00905-17.0093,https://smlouvy.gov.cz/smlouva/2885,10660.0
2789,2016-07-11T17:00:02+02:00,2016-07-11,KruV - RS (Kraj Vysočina),70890749,,11520.0,Finanční příspěvek na hospodaření v lesích ZZ00905-17.0024,https://smlouvy.gov.cz/smlouva/2893,11520.0
2793,2016-07-11T17:08:30+02:00,2016-07-01,"Nemocnice Milosrdných bratří, příspěvková organizace",48512478,,207591.0,Objednávka pásek,https://smlouvy.gov.cz/smlouva/2897,207591.0
2797,2016-07-11T17:22:13+02:00,2016-07-01,"Nemocnice Milosrdných bratří, příspěvková organizace",48512478,,72237.0,Přístroje na výrobu kyslíku,https://smlouvy.gov.cz/smlouva/2901,72237.0
2801,2016-07-11T17:52:24+02:00,2016-07-12,Městská část Praha 19,00231304,90000.0,110000.0,rekonstrukce bytové jednotky,https://smlouvy.gov.cz/smlouva/2905,100000.0
2805,2016-07-11T17:55:20+02:00,2016-07-11,"Základní škola a Mateřská škola pro zrakově postižené, Plzeň, Lazaretní 25",49778200,2297855.97,2780405.72,"Smlouva o dílo na základě nabídky podané v rámci výběrového řízení na veřejnou zakázku „Vybavení pavilonů novými plynovými zdroji vytápění a oprava otopné soustavy v budovách MŠ pro vady řeči, Ke Špitálskému lesu 3, Plzeň“",https://smlouvy.gov.cz/smlouva/2909,2539130.845
2821,2016-07-12T07:05:36+02:00,2015-11-24,Fakturace (Ministerstvo obrany),60162694,,750000.0,RS periodické tlakové zkoušky a opravy hasicích přístrojů 2016-2017,https://smlouvy.gov.cz/smlouva/2925,750000.0
2829,2016-07-12T07:20:09+02:00,2016-07-07,STATUTÁRNÍ MĚSTO LIBEREC,00262978,1894774.0,2292677.0,"ZŠ Liberec, Jabloňová 564/43 - úpravy kuchyně",https://smlouvy.gov.cz/smlouva/2933,2093725.5
2833,2016-07-12T07:20:14+02:00,2015-11-25,Fakturace (Ministerstvo obrany),60162694,,750000.0,RS zabezpečení závodního stravování pro VZ Travčice 2016 a 2017,https://smlouvy.gov.cz/smlouva/2937,750000.0
2837,2016-07-12T07:27:25+02:00,2016-07-08,Město Jindřichův Hradec,00246875,1688393.59,2042956.24,SOD - Chodník do Radouňky podél silnice II/128,https://smlouvy.gov.cz/smlouva/2941,1865674.915
2841,2016-07-12T07:29:36+02:00,2016-07-08,"Nemocnice Třinec, příspěvková organizace",00534242,250000.0,302500.0,Hysteroresektoskop Tekno-monopolární,https://smlouvy.gov.cz/smlouva/2945,276250.0
2845,2016-07-12T07:30:30+02:00,2016-07-07,"Správa a údržba silnic Jihomoravského kraje, příspěvková organizace kraje",70932581,188435.6,,"II/383 Řícmanice, ul. Husova - oprava povrchu.",https://smlouvy.gov.cz/smlouva/2949,188435.6
2849,2016-07-12T07:39:02+02:00,2016-07-07,Střední škola automobilní Holice,13582909,,97356.6,Pořízení šatních skříněk,https://smlouvy.gov.cz/smlouva/2953,97356.6
2853,2016-07-12T07:40:56+02:00,2016-07-12,Městský úřad Bohumín,00297569,63280.0,76569.0,Objednávka,https://smlouvy.gov.cz/smlouva/2957,69924.5
2857,2016-07-12T07:50:38+02:00,2016-07-08,"Nemocnice Třinec, příspěvková organizace",00534242,250000.0,302500.0,Hysteroresektoskop Tekno-monopolární,https://smlouvy.gov.cz/smlouva/2961,276250.0
2861,2016-07-12T07:53:46+02:00,2016-07-11,TECHNICKÉ SLUŽBY HRADEC KRÁLOVÉ,64809447,73200.0,88572.0,Havarijní oprava střechy ZUŠ Na Střezině Brandlova,https://smlouvy.gov.cz/smlouva/2965,80886.0
2865,2016-07-12T07:55:33+02:00,2016-07-01,"Nemocnice Milosrdných bratří, příspěvková organizace",48512478,,214411.0,Objednávka reagencií,https://smlouvy.gov.cz/smlouva/2969,214411.0
2869,2016-07-12T08:02:15+02:00,2014-11-20,"Technické sítě Brno, akciová společnost",25512285,,,Rámcová smlouva na dodávky materiálů,https://smlouvy.gov.cz/smlouva/2973,
2873,2016-07-12T08:03:00+02:00,2016-07-11,"Nemocnice Milosrdných bratří, příspěvková organizace",48512478,,161826.0,Objednávka pásek,https://smlouvy.gov.cz/smlouva/2977,161826.0
2877,2016-07-12T08:02:51+02:00,2014-10-16,Univerzita Karlova v Praze,00216208,5000000.0,,"1.LF UK OVZ 2014K-0010 rámcová kupní smlouva, dodávka tonerů I.",https://smlouvy.gov.cz/smlouva/2981,5000000.0
2881,2016-07-12T08:02:31+02:00,2014-12-19,Univerzita Karlova v Praze,00216208,5000000.0,,"1.LF UK OVZ 2014K-0020 rámcová kupní smlouva, dodávka kancelářských potřeb",https://smlouvy.gov.cz/smlouva/2985,5000000.0
2885,2016-07-12T08:03:02+02:00,2015-12-17,Univerzita Karlova v Praze,00216208,3759658.0,,"1.LFUK OVZ  2015L-0064 smlouva o dílo, provádění úklidových služeb",https://smlouvy.gov.cz/smlouva/2989,3759658.0
2889,2016-07-12T08:02:40+02:00,2016-04-20,Univerzita Karlova v Praze,00216208,1074637.2,1300311.01,"1.LF UK OVZ 2016K-0001 rámcová kupní smlouva, dodávka tonerů II.",https://smlouvy.gov.cz/smlouva/2993,1187474.105
